번호,사업장명,소재지전체주소,도로명전체주소,도로명우편번호,자연환경,숙소환경,테마,지역코드,상세코드,위도,경도,COL1,COL2
1381,물꽃캠핑장,경기도 연천군 군남면 황지리 634-1번지,경기도 연천군 군남면 청정로 2122,11008,river,glamping,couple,3,310,38.03716,127.0279,,
1382,힐링카라반,경기도 연천군 장남면 원당리 385-11번지,경기도 연천군 장남면 장백로330번길 46-97,11050,sea,easycamping,kids,3,310,37.99413,126.891,,
1383,써니힐즈 오토캠핑장,경기도 연천군 장남면 원당리 45-8,경기도 연천군 장남면 장백로330번길 137-28,11050,lake,caravan,pet,3,310,37.99602,126.8883,,
1384,에브라임캠핑장,경기도 연천군 신서면 도신리 787번지,경기도 연천군 신서면 연신로866번길 25,11003,mountain,camping,family,3,310,38.15799,127.1044,,
1385,땅에미소캠핑장,경기도 연천군 청산면 장탄리 1074번지,경기도 연천군 청산면 거저울길 371,11020,river,glamping,couple,3,310,38.05469,127.0897,,
1386,로하스캠핑,경기도 연천군 중면 삼곶리 185,경기도 연천군 중면 군중로 319-46,11004,sea,easycamping,kids,3,310,38.1325,127.0258,,
1387,고대산캠핑리조트,경기도 연천군 신서면 대광리 130-3번지,경기도 연천군 신서면 고대산길 104,11001,lake,caravan,pet,3,310,38.21306,127.1469,,
1388,조각가 박시동 미술관,경기도 연천군 백학면 석장리 875-16,경기도 연천군 백학면 백왕로225번길 240-1,11048,mountain,camping,family,3,310,38.0539,126.9178,,
1389,숲속의 쉼터,경기도 연천군 전곡읍 양원리 203,경기도 연천군 전곡읍 양원로268번길 83,11040,river,glamping,couple,3,310,37.96924,127.0293,,
1390,장남동산농원,경기도 연천군 장남면 원당리 700-2,경기도 연천군 장남면 술이홀로63번길 41-17,11050,sea,easycamping,kids,3,310,37.97045,126.8908,,
1391,랩도그빌,경기도 연천군 청산면 대전리 406번지,경기도 연천군 청산면 청창로200번길 33,11022,lake,caravan,pet,3,310,38.00794,127.0889,,
1392,로얄카바나,경기도 연천군 연천읍 고문리 420-1번지,경기도 연천군 연천읍 현문로 339-10,11018,mountain,camping,family,3,310,38.0635,127.1014,,
1393,YC글램핑,경기도 연천군 미산면 백석리 855번지,경기도 연천군 미산면 청정로 1049,11045,river,glamping,couple,3,310,38.05297,126.9643,,
1394,연천 한여울팜파크 글램핑장,경기도 연천군 연천읍 고문리 산 36번지,경기도 연천군 연천읍 현문로 537,11018,sea,easycamping,kids,3,310,38.06583,127.1224,,
1395,DMZ  마루 캠핑,경기도 연천군 중면 삼곶리 317-3번지,경기도 연천군 중면 군중로 399,11004,lake,caravan,pet,3,310,38.13494,127.0194,,
1396,삼화리 동광 캠핑장,경기도 연천군 미산면 삼화리 112번지,경기도 연천군 미산면 어삼로 447-30,11047,mountain,camping,family,3,310,38.02219,126.9798,,
1397,연천 사미천 캠핑장,경기도 연천군 장남면 원당리 41번지,경기도 연천군 장남면 장백로330번길 236,11050,river,glamping,couple,3,310,37.99613,126.8904,,
1398,연천 당포성 캠핑장,경기도 연천군 미산면 동이리 776번지,경기도 연천군 미산면 마동로 38-50,11047,sea,easycamping,kids,3,310,38.0215,126.9874,,
1399,하늘그린캠프,강원도 인제군 상남면 상남리 1616-6,강원도 인제군 상남면 아홉사리로 2505-31,24664,mountain,camping,family,4,409,37.863,128.2267,,
1400,회산백련지 오토캠핑장,전라남도 무안군 일로읍 복룡리 150 회산백련지시설사업소,전라남도 무안군 일로읍 백련로 333,58571,river,glamping,couple,11,1108,34.86275,126.5255,,
1401,캠프향기,대전광역시 동구 상소동 50번지,대전광역시 동구 산내로 710 (상소동),34712,sea,easycamping,kids,5,501,36.23598,127.4655,,
1402,바라산자연휴양림 야영장,경기도 의왕시 학의동 산 117-1번지,경기도 의왕시 북골안길 96 (학의동),16016,lake,caravan,pet,3,328,37.36787,127.0207,,
1403,무릉계곡 힐링캠프장,강원도 동해시 삼화동 858-10번지,강원도 동해시 삼화로 467 (삼화동),25746,mountain,camping,family,4,405,37.46389,129.0248,,
1404,가인야영장,전라남도 장성군 북하면 약수리 252-1 내장산국립공원백암사무소,전라남도 장성군 북하면 백양로 1116,57205,sea,easycamping,kids,11,1116,35.42614,126.8793,,
1405,한실관광농원 야영장,전라남도 장성군 삼서면 대곡리 466번지,전라남도 장성군 삼서면 대곡한실길 68-17,57255,lake,caravan,pet,11,1116,35.23293,126.656,,
1406,옛서당 캠핑농원,전라남도 장성군 삼계면 화산리 47번지,전라남도 장성군 삼계면 화산길 1,57234,mountain,camping,family,11,1116,35.28574,126.6445,,
1407,라온 글램핑,전라남도 장성군 북하면 월성리 811-2번지,전라남도 장성군 북하면 병풍로 963-14,57208,river,glamping,couple,11,1116,35.33375,126.8638,,
1408,편백힐(치유의숲),전라남도 장성군 북하면 376,전라남도 장성군 북하면 하남실길 212,57207,sea,easycamping,kids,11,1116,35.40735,126.8796,,
1409,오투스토리 캠핑장,전라남도 장성군 황룡면 아곡리 46-1,전라남도 장성군 황룡면 홍길동로 271,57223,mountain,camping,family,11,1116,35.31183,126.7433,,
1410,애플 글램핑,전라남도 장성군 북하면 성암리 1289-2번지,전라남도 장성군 북하면 담장로 1279,57207,river,glamping,couple,11,1116,35.40357,126.8994,,
1411,솔내음 물댄동산 야영장,전라남도 장성군 삼계면 부성리 7-1번지,전라남도 장성군 삼계면 자초로 198,57234,lake,caravan,pet,11,1116,35.30274,126.6549,,
1412,제주베스트힐,제주특별자치도 제주시 조천읍 교래리 786-30,제주특별자치도 제주시 조천읍 남조로 2109-36,63345,mountain,camping,family,18,1801,33.42762,126.6666,,
1413,별헤는밤,제주특별자치도 제주시 애월읍 유수암리 2270-2,제주특별자치도 제주시 애월읍 광상로 348,63067,river,glamping,couple,18,1801,33.44338,126.3968,,
1414,숲속야영장 휴림,제주특별자치도 제주시 애월읍 광령리 2873-6,제주특별자치도 제주시 애월읍 광령남서길 40,63062,sea,easycamping,kids,18,1801,33.37017,126.482,,
1415,선양캠핑장,제주특별자치도 제주시 조천읍 와흘리 263번지,제주특별자치도 제주시 조천읍 와흘로 350,63344,lake,caravan,pet,18,1801,33.47508,126.6436,,
1416,디-포레 카라반 파크,제주특별자치도 제주시 구좌읍 송당리 1901-2,제주특별자치도 제주시 구좌읍 송당6길 78-1,63355,mountain,camping,family,18,1801,33.46535,126.7823,,
1417,문복산캠핑장,경상북도 경주시 산내면 대현리 2747-273,경상북도 경주시 산내면 문복로 333-199,38187,river,glamping,couple,16,1602,35.66193,129.0548,,
1418,블루원글램핑,경상북도 경주시 천군동 산 30-4 블루원보문컨트리클럽,경상북도 경주시 보불로 391,38118,sea,easycamping,kids,16,1602,35.82796,129.292,,
1419,덕동 산상낙원,충청북도 제천시 백운면 덕동리 378번지,충청북도 제천시 백운면 덕동로 609-61,27101,lake,caravan,pet,8,807,37.21343,127.9456,,
1420,대현캠핑장,충청북도 제천시 봉양읍 명암리 198번지,충청북도 제천시 봉양읍 명암로 692,27108,mountain,camping,family,8,807,37.19458,128.1547,,
1421,무도글램핑,충청북도 제천시 송학면 무도리 573,충청북도 제천시 송학면 송학로2길 140-29,27126,river,glamping,couple,8,807,37.17182,128.2619,,
1422,월악산오토캠핑장,충청북도 제천시 한수면 복평리 111-8번지,충청북도 제천시 한수면 미륵송계로 1868,27226,sea,easycamping,kids,8,807,36.90281,128.079,,
1423,미소가든펜션야영장,충청북도 제천시 봉양읍 옥전리 59-4번지,충청북도 제천시 봉양읍 제원로6길 39,27106,lake,caravan,pet,8,807,37.17172,128.1153,,
1424,선녀와 나무꾼 캠핑장,충청북도 제천시 청풍면 신리 214-4,충청북도 제천시 청풍면 청풍명월로 173-18,27214,mountain,camping,family,8,807,37.00492,128.151,,
1425,(주)에이치엠제이,충청북도 제천시 청풍면 연곡리 226번지,충청북도 제천시 청풍면 청풍명월로 244,27214,sea,easycamping,kids,8,807,37.00976,128.155,,
1426,제천 모노레일 글램핑,충청북도 제천시 청풍면 도곡리 108-1번지,충청북도 제천시 청풍면 청풍명월로 898,27214,lake,caravan,pet,8,807,37.00189,128.1338,,
1427,제천 명암 오토 캠핑장,충청북도 제천시 봉양읍 명암리 605-6,충청북도 제천시 봉양읍 명암로5길 1,27108,mountain,camping,family,8,807,37.18741,128.131,,
1428,엘림펜션캠핑장,충청북도 제천시 덕산면 수산리 219,충청북도 제천시 덕산면 월악산로2길 7-23,27225,river,glamping,couple,8,807,36.91369,128.1184,,
1429,제천공전자연캠핑장,충청북도 제천시 봉양읍 공전리 265,충청북도 제천시 봉양읍 의암로 345,27111,sea,easycamping,kids,8,807,37.11429,128.0794,,
1430,달재오토캠핑장,충청북도 제천시 백운면 덕동리 255번지,충청북도 제천시 백운면 덕동로2길 23-13,27101,lake,caravan,pet,8,807,37.21614,127.9569,,
1431,국립나주박물관 야외체험장,전라남도 나주시 반남면 신촌리,전라남도 나주시 반남면 고분로 747,58301,mountain,camping,family,11,1106,34.91687,126.6567,,
1432,자연애스토리,전라남도 나주시 문평면 학교리 162,전라남도 나주시 문평면 학교평전길 122,58202,river,glamping,couple,11,1106,35.09704,126.6609,,
1433,나주 글램핑 어스,전라남도 나주시 경현동 96-1,전라남도 나주시 경현길 65 (경현동),58247,sea,easycamping,kids,11,1106,35.03655,126.7052,,
1434,순천 승주CC 글램핑,전라남도 순천시 별량면 송학리 492-2,전라남도 순천시 별량면 오실길 333-1,57920,lake,caravan,pet,11,1110,34.89892,127.4441,,
1435,성동 서울숲 여름캠핑장,서울특별시 성동구 성수동1가 643번지,서울특별시 성동구 뚝섬로 273 (성수동1가),4770,mountain,camping,family,1,105,37.54176,127.0426,,
1436,인디어라운드(Indiaround),경기도 이천시 율현동 488-5,경기도 이천시 이섭대천로941번길 49-44 (율현동),17391,river,glamping,couple,3,319,37.25256,127.4389,,
1437,청암관광농원,경기도 이천시 부발읍 아미리 4-1,경기도 이천시 부발읍 황무로1720번길 74,17334,sea,easycamping,kids,3,319,37.26757,127.5163,,
1438,테르메덴,경기도 이천시 모가면 신갈리 360,경기도 이천시 모가면 사실로 984 (테르메덴),17406,lake,caravan,pet,3,319,37.1942,127.4463,,
1439,너와두리농촌캠핑장,충청북도 옥천군 청성면 거포리 762 한두레권역,충청북도 옥천군 청성면 한두레로 387,29017,mountain,camping,family,8,805,36.32562,127.729,,
1440,장령산자연휴양림 야영장,충청북도 옥천군 군서면 금산리 산 15-1번지,충청북도 옥천군 군서면 장령산로 519,29059,river,glamping,couple,8,805,36.23247,127.5626,,
1441,나드리 캠핑장,충청북도 옥천군 청성면 삼남리 452,충청북도 옥천군 청성면 삼남2길 6,29018,sea,easycamping,kids,8,805,36.29207,127.7404,,
1442,송정자연휴양림,경상북도 칠곡군 석적읍 반계리 산 9-1,경상북도 칠곡군 석적읍 반계3길 88,39848,lake,caravan,pet,16,1620,36.02333,128.4483,,
1443,경상북도 가산산성 야영장,경상북도 칠곡군 동명면 득명리 113-1번지,경상북도 칠곡군 동명면 한티로 1034,39855,mountain,camping,family,16,1620,36.01743,128.6202,,
1444,가산글램핑,경상북도 칠곡군 가산면 학하리 1178-1번지,경상북도 칠곡군 가산면 학하2길 54-55,39849,river,glamping,couple,16,1620,36.08862,128.475,,
1445,팔공산금화자연휴양림야영장,경상북도 칠곡군 가산면 금화리 산 49-1,경상북도 칠곡군 가산면 가산로 323,39852,sea,easycamping,kids,16,1620,36.05388,128.5604,,
1446,팔공산 글램핑,경상북도 칠곡군 동명면 남원리 1125번지,경상북도 칠곡군 동명면 구남로 281,39855,lake,caravan,pet,16,1620,36.002,128.5762,,
1447,대성글램핑,경상북도 칠곡군 북삼읍 숭오리 879번지,경상북도 칠곡군 북삼읍 금오동천로 120-8,39800,mountain,camping,family,16,1620,36.06501,128.2999,,
1448,(주)동재가산수피아,경상북도 칠곡군 가산면 학하리 1206-1,경상북도 칠곡군 가산면 학하4길 57-105,39849,river,glamping,couple,16,1620,36.08548,128.486,,
1449,농업회사법인 오송 주식회사,경상북도 칠곡군 왜관읍 봉계리 474-1번지,경상북도 칠곡군 왜관읍 봉계로 348,39870,sea,easycamping,kids,16,1620,35.99748,128.4532,,
1450,강동그린웨이 가족캠핑장,서울특별시 강동구 둔촌동 562-9번지,서울특별시 강동구 천호대로206길 87 (둔촌동),5357,lake,caravan,pet,1,106,37.53583,127.1541,,
1451,옥성자연휴양림,경상북도 구미시 옥성면 주아리 산 144-1,경상북도 구미시 옥성면 휴양림길 150,39102,mountain,camping,family,16,1604,36.27976,128.2844,,
1452,금오산 야영장,경상북도 구미시 남통동 산 24-5,경상북도 구미시 금오산상가길 12,39309,river,glamping,couple,16,1604,36.11075,128.3136,,
1453,구미캠핑장,경상북도 구미시 양호동 614-1번지,경상북도 구미시 낙동제방길 200 (양호동),39193,sea,easycamping,kids,16,1604,36.1385,128.3751,,
1454,하늘구름길캠핑장,전라북도 임실군 성수면 왕방리 232-2번지,전라북도 임실군 성수면 왕방길 360,55917,lake,caravan,pet,9,910,35.62444,127.399,,
1455,강변사리캠핑장,전라북도 임실군 덕치면 천담리 89-3번지,전라북도 임실군 덕치면 강동로 865-20 (섬진강청소년수련원),55942,mountain,camping,family,9,910,35.4954,127.1901,,
1456,태안둘레길캠핑장,충청남도 태안군 이원면 내리 503-20번지,충청남도 태안군 이원면 꾸지나무길 37-76,32100,river,glamping,couple,7,702,36.93199,126.2939,,
1457,송도오토캠핑장,충청남도 태안군 소원면 모항리 466-22,충청남도 태안군 소원면 모항항길 94,32123,sea,easycamping,kids,7,702,36.77782,126.1354,,
1458,매화둠벙마을 영농조합법인,충청남도 태안군 원북면 동해리 779-8번지,충청남도 태안군 원북면 동해길 301-41,32113,lake,caravan,pet,7,702,36.81236,126.2267,,
1459,구름포오토캠핑장,충청남도 태안군 소원면 의항리 157번지,충청남도 태안군 소원면 구름포길 117,32121,mountain,camping,family,7,702,36.83505,126.1527,,
1460,서해땅끝파도리아치내캠핑장,충청남도 태안군 소원면 파도리 1318번지,충청남도 태안군 소원면 아치내길 216,32124,river,glamping,couple,7,702,36.71971,126.1275,,
1461,어은돌야영장,충청남도 태안군 소원면 모항리 792-10번지,충청남도 태안군 소원면 연들길 67-3,32123,sea,easycamping,kids,7,702,36.75228,126.1333,,
1462,만리포미소카라반캠핑장,충청남도 태안군 소원면 모항리 1325-120번지 외 2필지,충청남도 태안군 소원면 만리포2길 112-1,32123,river,glamping,couple,7,702,36.78391,126.1406,,
1463,곰섬야영장,충청남도 태안군 남면 신온리 903-34,충청남도 태안군 남면 곰섬로 500-19,32158,sea,easycamping,kids,7,702,36.58853,126.2911,,
1464,청산야영장,충청남도 태안군 원북면 청산리 254-11번지,충청남도 태안군 원북면 청산길 279,32111,lake,caravan,pet,7,702,36.81828,126.2792,,
1465,만리포몰디브,충청남도 태안군 소원면 의항리 977-3,충청남도 태안군 소원면 천리포1길 143-24,32121,mountain,camping,family,7,702,36.79653,126.1481,,
1466,그림나래힐링캠프,충청남도 태안군 근흥면 용신리 41-6번지,충청남도 태안군 근흥면 궁틀길 62-51,32129,lake,caravan,pet,7,702,36.7186,126.2447,,
1467,추억촌,강원도 강릉시 성산면 어흘리 376-3번지,강원도 강릉시 성산면 대관령옛길 10,25443,river,glamping,couple,4,401,37.71736,128.8034,,
1468,국립자연휴양림관리소(대관령자연휴양림),강원도 강릉시 성산면 어흘리 산 2-1번지,강원도 강릉시 성산면 삼포암길 133,25443,sea,easycamping,kids,4,401,37.71442,128.7848,,
1469,진고개계곡야영장,강원도 강릉시 연곡면 삼산리 1039-1번지,강원도 강릉시 연곡면 진고개로 1026,25400,lake,caravan,pet,4,401,37.82781,128.6553,,
1470,폭포골자연휴양림야영장,강원도 강릉시 연곡면 퇴곡리 51번지,강원도 강릉시 연곡면 황어대길 46-3,25426,mountain,camping,family,4,401,37.84868,128.7484,,
1471,강릉 계곡 스카이케빈,강원도 강릉시 연곡면 삼산리 1307-2,강원도 강릉시 연곡면 부연동길 840,25400,sea,easycamping,kids,4,401,37.82781,128.6553,,
1472,대기리 산촌체험학교 야영장,강원도 강릉시 왕산면 대기리 953번지,강원도 강릉시 왕산면 왕산로 1327,25642,lake,caravan,pet,4,401,37.57822,128.7491,,
1473,솔봉계곡쉼터야영장,강원도 강릉시 연곡면 삼산리 1377-30번지,강원도 강릉시 연곡면 진고개로 1186,25400,mountain,camping,family,4,401,37.82781,128.6553,,
1474,정원캠핑장,강원도 강릉시 주문진읍 삼교리 761-3번지,강원도 강릉시 주문진읍 신리천로 1191-13,25401,river,glamping,couple,4,401,37.89503,128.7403,,
1475,삼산야영장,강원도 강릉시 연곡면 삼산리 839-3번지,강원도 강릉시 연곡면 진고개로 1306,25400,sea,easycamping,kids,4,401,37.82781,128.6553,,
1476,물내치기,강원도 강릉시 왕산면 대기리 1688-2번지,강원도 강릉시 왕산면 노추산로 1151-5,25642,lake,caravan,pet,4,401,37.57822,128.7491,,
1477,달빛고운 월성캠핑장,경상남도 거창군 북상면 월성리 1084-4번지,경상남도 거창군 북상면 덕유월성로 1439-14,50100,mountain,camping,family,17,1702,35.76434,127.743,,
1478,농업회사법인 주식회사 태신목장 예산지점,충청남도 예산군 고덕면 상몽리 762-3,충청남도 예산군 고덕면 몽곡상몽길 373-7,32401,river,glamping,couple,7,711,36.80165,126.7082,,
1479,캠핑하우스,충청남도 천안시 동남구 용곡동 316-14,충청남도 천안시 동남구 용곡1길 98 (용곡동),31183,sea,easycamping,kids,7,712,36.79263,127.1445,,
1480,성당포구 금강체험관 야영장,전라북도 익산시 성당면 성당리 283-6,전라북도 익산시 성당면 성당로 762,54504,lake,caravan,pet,9,909,36.13074,126.9215,,
1481,이포보 웰빙 캠핑장,경기도 여주시 대신면 천서리 755,경기도 여주시 대신면 여양로 1935-69,12608,mountain,camping,family,3,318,37.4012,127.54,,
1482,금은모래 캠핑장,경기도 여주시 연양동 304-3번지,경기도 여주시 강변유원지길 105 (연양동),469118,river,glamping,couple,3,318,37.28223,127.6659,,
1483,해여림 빌리지,경기도 여주시 산북면 상품리 448,경기도 여주시 산북면 해여림로 78,12603,sea,easycamping,kids,3,318,37.3921,127.4379,,
1484,파인 관광농원,경기도 여주시 가남읍 신해리 649-10번지,경기도 여주시 가남읍 경충대로 1483-25,12655,lake,caravan,pet,3,318,37.21435,127.5318,,
1485,하늘연캠핑장,경기도 파주시 적성면 마지리 70,경기도 파주시 적성면 마지초교길 22-61,10803,mountain,camping,family,3,309,37.95102,126.9215,,
1486,파주기산캠프,경기도 파주시 광탄면 기산리 471-2,경기도 파주시 광탄면 기산로 207-31,10953,river,glamping,couple,3,309,37.77546,126.9218,,
1487,캠프예그리나,경기도 파주시 광탄면 기산리 659-0,경기도 파주시 광탄면 쇠장이길 56-0,10953,sea,easycamping,kids,3,309,37.77685,126.9098,,
1488,율곡캠핑장,경기도 파주시 파평면 율곡리 13,경기도 파주시 파평면 장승배기로 390-217,10809,lake,caravan,pet,3,309,37.89166,126.8291,,
1489,느티나무 그늘아래 캠핑장,경기도 파주시 문산읍 사목리 328,경기도 파주시 문산읍 사목로108번길 63-11,10818,river,glamping,couple,3,309,37.87574,126.7565,,
1490,박석캠핑장,경기도 파주시 탄현면 낙하리 252,경기도 파주시 탄현면 동오리길 135-48 (박석농원),10857,sea,easycamping,kids,3,309,37.83541,126.7394,,
1491,하마캠핑장,경기도 파주시 적성면 자장리 148,경기도 파주시 적성면 국사로 297,10801,lake,caravan,pet,3,309,37.96109,126.8696,,
1492,호수캠핑장,경기도 파주시 광탄면 기산리 387-7,경기도 파주시 광탄면 기산로 413-69,10953,mountain,camping,family,3,309,37.77563,126.9331,,
1493,프린세스 캠핑장,충청남도 공주시 신관동 508번지,충청남도 공주시 치미마을길 74 (신관동),32529,river,glamping,couple,7,701,36.47656,127.1246,,
1494,오공오 캠핑,충청남도 공주시 사곡면 호계리 594-9번지,충청남도 공주시 사곡면 호계황골길 43,32523,sea,easycamping,kids,7,701,36.50108,127.0201,,
1495,계룡산글램핑 동월숲,충청남도 공주시 반포면 학봉리 197-5,충청남도 공주시 반포면 계룡대로 1352,32626,lake,caravan,pet,7,701,36.35891,127.2407,,
1496,공주계곡캠핑장,충청남도 공주시 사곡면 운암리 468-2번지,충청남도 공주시 사곡면 운정길 20,32520,mountain,camping,family,7,701,36.5579,127.0201,,
1497,주식회사농업회사법인 장승마을,충청남도 공주시 사곡면 운암리 511-1번지,충청남도 공주시 사곡면 유구마곡사로 1231,32520,sea,easycamping,kids,7,701,36.55752,127.022,,
1498,북캠프 주식회사,충청남도 공주시 신풍면 영정리 177-4,충청남도 공주시 신풍면 영정길 155-3,32526,lake,caravan,pet,7,701,36.51456,126.9914,,
1499,농업회사법인 화봉(주),충청남도 공주시 정안면 화봉리 433-3번지,충청남도 공주시 정안면 화봉됨박골길 55-74,32514,mountain,camping,family,7,701,36.53617,127.1007,,
1500,오크힐글램핑,인천광역시 강화군 화도면 흥왕리 914-9번지,인천광역시 강화군 화도면 해안남로1998번길 8-28,23062,lake,caravan,pet,2,201,37.60485,126.4113,,
1501,강화캠핑파크,인천광역시 강화군 길상면 초지리 1140-4 1140-4,인천광역시 강화군 길상면 신촌로146번길 14-11,23049,mountain,camping,family,2,201,37.62766,126.5166,,
1502,함허동천야영장,인천광역시 강화군 화도면 사기리 340-5번지,인천광역시 강화군 화도면 해안남로1196번길 38,23059,river,glamping,couple,2,201,37.61196,126.453,,
1503,강화도산들애농원 캠핑수영장,인천광역시 강화군 강화읍 국화리 344-1,인천광역시 강화군 강화읍 고비고개로 171,23028,river,glamping,couple,2,201,37.74164,126.4595,,
1504,문라이트 야영장,인천광역시 강화군 길상면 선두리 977-23번지,인천광역시 강화군 길상면 해안남로 656,23051,lake,caravan,pet,2,201,37.60246,126.492,,
1505,교동아일랜드,인천광역시 강화군 교동면 읍내리 6-5,인천광역시 강화군 교동면 교동남로 275,23001,lake,caravan,pet,2,201,37.77284,126.301,,
1506,덕산국민여가캠핑장,인천광역시 강화군 내가면 고천리 산 494번지,인천광역시 강화군 내가면 강화서로227번길 91,23018,mountain,camping,family,2,201,37.71749,126.3802,,
1507,숲속의베리팜,전라남도 화순군 백아면 맹리 329-1,전라남도 화순군 북면 백아로 25-48,58100,river,glamping,couple,11,1120,35.18074,127.0983,,
1508,(주)워렉스 캠핑랜드,전라남도 화순군 한천면 오음리 603,전라남도 화순군 한천면 죽헌로 376-37,58147,sea,easycamping,kids,11,1120,34.97284,127.0113,,
1509,첫마을 관광타운,전라남도 완도군 군외면 대문리 691-2번지,전라남도 완도군 군외면 청해진북로88번길 22,59105,lake,caravan,pet,11,1115,34.37229,126.656,,
1510,바다여행파크캠핑장,충청남도 태안군 원북면 방갈리 536 바다여행,충청남도 태안군 원북면 옥파로 1059-16,32105,mountain,camping,family,7,702,36.89108,126.2016,,
1511,학암포퍼스트카라반글램핑캠핑장,충청남도 태안군 원북면 방갈리 515-11,충청남도 태안군 원북면 옥파로 1169-3,32105,river,glamping,couple,7,702,36.89959,126.2052,,
1512,비비아트글램핑,충청남도 태안군 남면 신온리 169-18,충청남도 태안군 남면 마검포길 201-32,32158,sea,easycamping,kids,7,702,36.61441,126.3037,,
1513,비비오토캠프,충청남도 태안군 남면 신온리 169-13번지,충청남도 태안군 남면 마검포길 201-32,32158,lake,caravan,pet,7,702,36.61362,126.304,,
1514,캠핑코리아,충청남도 태안군 원북면 신두리 1227-14번지,충청남도 태안군 원북면 신두로 689-37,32108,mountain,camping,family,7,702,36.83376,126.1828,,
1515,초막골생태공원 느티나무야영장,경기도 군포시 산본동 925,경기도 군포시 초막골길 130 (산본동),15868,sea,easycamping,kids,3,329,37.34732,126.9181,,
1516,벽계야영장,경상남도 의령군 궁류면 벽계리 481-1,경상남도 의령군 궁류면 벽계로 201 (화장실),52115,lake,caravan,pet,17,1710,35.42575,128.2079,,
1517,설뫼충효테마파크 야영장,경상남도 의령군 부림면 입산리 15-1번지 설뫼지구 농어촌테마공원,경상남도 의령군 부림면 입산로 178,52109,mountain,camping,family,17,1710,35.45661,128.3521,,
1518,십자봉 야영장,충청북도 제천시 백운면 덕동리 284-0번지,충청북도 제천시 백운면 덕동로 527-4,27101,sea,easycamping,kids,8,807,37.21353,127.9549,,
1519,덕동골 캠핑장,충청북도 제천시 백운면 덕동리 292-2,충청북도 제천시 백운면 덕동로2길 23-26,27101,lake,caravan,pet,8,807,37.21722,127.9569,,
