번호,사업장명,소재지전체주소,도로명전체주소,도로명우편번호,자연환경,숙소환경,테마,지역코드,상세코드,위도,경도,COL1,COL2
1,늘예솔 글램핑,경상남도 거창군 북상면 월성리 941-4번지,경상남도 거창군 북상면 덕유월성로 1384-5,50100,river,glamping,couple,17,1703,35.76419,127.7368363,,
2,아쿠아마린 글램핑,경기도 포천시 이동면 도평리 333번지,경기도 포천시 이동면 성장로1289번길 204,11110,sea,easycamping,kids,3,302,38.0757063,127.4032977,,
3,부에노스아이레스,경기도 가평군 가평읍 복장리 580-3번지,경기도 가평군 가평읍 상지로 949,12430,lake,caravan,pet,3,301,37.740356,127.4999057,,
4,오페라캠핑장,강원도 홍천군 내촌면 화상대리 산 375-2,강원도 홍천군 내촌면 아홉사리로 104-15,25163,river,glamping,couple,4,414,37.8018189,128.0035294,,
5,사계절 야영장,충청북도 영동군 상촌면 대해리 1083-1,충청북도 영동군 상촌면 물한계곡로 700,29126,sea,easycamping,kids,8,804,36.101298,127.8848185,,
6,해자연캠핑장,경기도 남양주시 오남읍 팔현리 9-22,경기도 남양주시 오남읍 팔현로175번길 310-60,12038,lake,caravan,pet,3,306,37.7009065,127.2628633,,
7,글램핑스테이션,충청북도 괴산군 연풍면 갈금리 255-19번지,충청북도 괴산군 연풍면 연풍로 823-9,28014,river,glamping,couple,8,801,36.7816546,127.9512861,,
8,청포대휴야영장,충청남도 태안군 남면 원청리 512-142,충청남도 태안군 남면 청포대길 63-6,32157,sea,easycamping,kids,7,702,36.6393956,126.3021005,,
9,옥산 호수정원(진달래 관광농원),충청남도 부여군 옥산면 봉산리 171-3,충청남도 부여군 옥산면 봉산로56번길 56,33204,lake,caravan,pet,7,707,36.1980162,126.7234974,,
10,휴림,경기도 여주시 산북면 주어리 368-1,경기도 여주시 산북면 주어로 204,12600,mountain,camping,family,3,318,37.4016889,127.442999,,
11,그라티아 글램핑,경기도 가평군 가평읍 두밀리 216,경기도 가평군 가평읍 태봉두밀로 421-24,12425,river,glamping,couple,3,301,37.8152713,127.4547979,,
12,백운산캠핑장,경상남도 함양군 백전면 백운리 120-2번지,경상남도 함양군 백전면 함양남서로 2755,50026,sea,easycamping,kids,17,1717,35.5884737,127.6371657,,
13,도봉야영장,경기도 의정부시 호원동 163,경기도 의정부시 창포원로 81 (호원동),11716,lake,caravan,pet,3,322,37.6951064,127.046636,,
14,에제르파크,인천광역시 남동구 장수동 141-7,인천광역시 남동구 만의골로 155 (장수동),21533,river,glamping,couple,2,204,37.4547802,126.7457475,,
15,와우파크,강원도 강릉시 사천면 사천진리 242-1번지,강원도 강릉시 사천면 공회당길 7-13,25435,lake,caravan,pet,4,401,37.832069,128.8714898,,
16,팜스토리,경상북도 청도군 운문면 봉하리 817번지 (817-1번지),경상북도 청도군 운문면 운북로 443-18,38365,river,glamping,couple,16,1619,35.8041233,128.9763417,,
17,라무 키즈 글램핑,경기도 가평군 북면 도대리 324-10,경기도 가평군 북면 가화로 2372-42,12401,lake,caravan,pet,3,301,37.9542988,127.477874,,
18,솔향기캠핑장,충청남도 태안군 소원면 모항리 442-3,충청남도 태안군 소원면 모항항길 29,32123,river,glamping,couple,7,702,36.77741217,126.1429476,,
19,충주 커피박물관 관광농원 야영장,충청북도 충주시 살미면 내사리 산 20-2,충청북도 충주시 살미면 월악로 432,27492,sea,easycamping,kids,8,810,36.9044212,128.0144229,,
20,전원일기 오토캠핑장,경상북도 경주시 산내면 대현리 2372,경상북도 경주시 산내면 문복로 578,38187,lake,caravan,pet,16,1602,35.6842054,129.0502907,,
21,전월산 국민여가캠핑장,충청남도 연기군 남면 월산리 320-1,세종특별자치시 연기면 갈매로 169,30129,mountain,camping,family,6,601,36.4800668,127.269419,,
22,트리앤캠프스토리,강원도 양구군 양구읍 군량리 450,강원도 양구군 양구읍 성곡로 849,24514,river,glamping,couple,4,407,38.1602934,127.9637103,,
23,청포대 일등캠핑장,충청남도 태안군 남면 양잠리 1230-3,충청남도 태안군 남면 청포대길 125,32155,sea,easycamping,kids,7,702,36.6442404,126.3004253,,
24,한자루체험농원(휴앤아크),강원도 인제군 기린면 방동리 68-3,강원도 인제군 기린면 방동약수로 68,24656,lake,caravan,pet,4,409,37.9126207,128.4151868,,
25,산들내캠핑장,전라북도 정읍시 산외면 정량리 85-1 인문학뇌만들기 문화공간 창,전라북도 정읍시 산외면 종운로 260,56123,mountain,camping,family,9,912,35.606664,127.06242,,
26,솔라캠프,경상북도 안동시 와룡면 가구리 377-1,경상북도 안동시 와룡면 농암로 101-44,36611,sea,easycamping,kids,16,1611,36.6197305,128.7775784,,
27,산책,경기도 가평군 북면 화악리 754-6번지,경기도 가평군 북면 화악산로 943-40,12402,lake,caravan,pet,3,301,37.9375355,127.5398139,,
28,젤루느린 달팽이,경상북도 문경시 가은읍 완장리 460번지,경상북도 문경시 가은읍 대야로 1290,36993,mountain,camping,family,16,1607,36.676402,127.95985,,
29,아이뜰관광농원,충청북도 괴산군 장연면 방곡리 607-4번지 아이뜰관광농원,충청북도 괴산군 장연면 충민로 1183,28008,river,glamping,couple,8,801,36.844573,127.9023632,,
30,청도 어울림 글램핑 타운,경상북도 청도군 매전면 관하리 420,경상북도 청도군 매전면 관하실길 28-42,38352,sea,easycamping,kids,16,1619,35.7089549,128.8181107,,
31,학암포나로글램핑캠핑장,충청남도 태안군 원북면 방갈리 515-173,충청남도 태안군 원북면 옥파로 1153,32105,lake,caravan,pet,7,702,36.8979606,126.2048652,,
32,내리계곡 솔바람 캠핑장,강원도 영월군 김삿갓면 내리 386-2번지,강원도 영월군 김삿갓면 내리계곡로 1039-14,26247,mountain,camping,family,4,420,37.0779437,128.7082094,,
33,별곰 캠핑힐,경상남도 하동군 청암면 상이리 1446,경상남도 하동군 청암면 사동길 2,52310,river,glamping,couple,17,1715,35.1810418,127.7547617,,
34,김제 모악산 캠핑파크(일반),전라북도 김제시 금산면 금산리 79-9,전라북도 김제시 금산면 모악로 476-31,54343,sea,easycamping,kids,9,903,35.7160081,127.0440067,,
35,해오름 글램핑,경기도 포천시 소흘읍 이곡리 479-8,경기도 포천시 소흘읍 광릉수목원로874번길 5,11187,lake,caravan,pet,3,302,37.777109,127.1464399,,
36,노을캠핑장,인천광역시 강화군 양도면 건평리 463-11번지,인천광역시 강화군 양도면 해안서로 695,23056,sea,easycamping,kids,2,201,37.6906939,126.3920765,,
37,어망골 캠핑장,충청남도 보령시 천북면 장은리 970,충청남도 보령시 천북면 사호장은로 638,33400,lake,caravan,pet,7,706,36.5055523,126.4905951,,
38,범화권역 글램핑장,충청북도 영동군 학산면 도덕리 806-3,충청북도 영동군 학산면 용화양강로 1380,29167,mountain,camping,family,8,804,36.0845127,127.7238831,,
39,오시유,충청남도 천안시 동남구 광덕면 광덕리 720-12번지,충청남도 천안시 동남구 광덕면 해수길 178-38,31220,river,glamping,couple,7,712,36.6756948,127.0278109,,
40,블루파크,경기도 포천시 화현면 명덕리 179-1,경기도 포천시 화현면 봉화로 267,11125,lake,caravan,pet,3,302,37.8723616,127.2784102,,
41,푸른섬 캠핑장,경기도 안산시 단원구 대부북동 1865-63,경기도 안산시 단원구 연목이길 31-21 (대부북동),15640,mountain,camping,family,3,308,37.258289,126.5731267,,
42,(주)하늘마음바이오 홍천지점 알파카스테이,강원도 홍천군 화촌면 풍천리 107-2번지,강원도 홍천군 화촌면 가락재로 206,25156,river,glamping,couple,4,414,37.8332545,127.8882651,,
43,용추솔밭관광농원,경상남도 함양군 안의면 상원리 757-19 관광농원,경상남도 함양군 안의면 용추계곡로 494-6,50005,sea,easycamping,kids,17,1717,35.6748198,127.7739851,,
44,달콤이네 캠핑장,강원도 원주시 문막읍 취병리 358번지,강원도 원주시 문막읍 취병로 106,26360,lake,caravan,pet,4,408,37.3111808,127.800606,,
45,대부관광농원 오캠핑,경기도 안산시 단원구 대부남동 647-1,경기도 안산시 단원구 대남로 642 (대부남동),15653,mountain,camping,family,3,308,37.2300463,126.5802849,,
46,하와이언캠프,인천광역시 옹진군 영흥면 내리 1327번지,인천광역시 옹진군 영흥면 영흥서로446번길 46,23117,river,glamping,couple,2,202,37.2688539,126.4708583,,
47,새연 글램핑 카라반 설악2호점,경기도 가평군 설악면 회곡리 24-2,경기도 가평군 설악면 유명로 1939-26,12459,lake,caravan,pet,3,301,37.6831942,127.4702712,,
48,두레캠핑장,경기도 가평군 청평면 상천리 1494번지 두레마을휴양림,경기도 가평군 청평면 상지로 171,12449,mountain,camping,family,3,301,37.7686813,127.4700681,,
49,마로니에숲 캠핑장,충청북도 옥천군 이원면 장찬리 145-9,충청북도 옥천군 이원면 장찬길 159-73,29061,river,glamping,couple,8,805,36.2451224,127.5941999,,
50,갈릴리 야영장,경기도 평택시 안중읍 학현리 129-10번지,경기도 평택시 안중읍 안중북로 119,17816,sea,easycamping,kids,3,320,36.9916333,126.9071514,,
51,황산도캠핑장,인천광역시 강화군 길상면 초지리 1328-2번지 대나무집,인천광역시 강화군 길상면 해안남로65번길 36-15,23052,lake,caravan,pet,2,201,37.6223499,126.5385599,,
52,대가야캠프타운,경상북도 고령군 운수면 신간리 465,경상북도 고령군 운수면 물한1길 78-8,40123,mountain,camping,family,16,1603,35.7956332,128.3159878,,
53,숲속의 작은집,강원도 영월군 무릉도원면 두산리 산 175,강원도 영월군 무릉도원면 새막골길 133,26200,river,glamping,couple,4,420,37.3173996,128.1646503,,
54,월드니스 오토캠핑장,강원도 영월군 무릉도원면 도원리 795-1,강원도 영월군 무릉도원면 도원운학로 475-10,26201,sea,easycamping,kids,4,420,37.3001573,128.221309,,
55,외룡송어회 캠핑장,강원도 영월군 김삿갓면 외룡리 651-1번지,강원도 영월군 김삿갓면 직실길 7,26247,lake,caravan,pet,4,420,37.1167026,128.6423741,,
56,넵투누스 카라반,경기도 가평군 청평면 고성리 25-1,경기도 가평군 청평면 고재길 262-123,12456,mountain,camping,family,3,301,37.7000527,127.5172798,,
57,시공간,전라남도 여수시 남면 유송리 702번지,전라남도 여수시 남면 솔고지길 105,59785,river,glamping,couple,11,1112,34.5475652,127.7262263,,
58,풀앤밸리야영장,강원도 양양군 현북면 원일전리 34-1번지,강원도 양양군 현북면 남대천로 1352,25049,sea,easycamping,kids,4,404,37.9935081,128.6524927,,
59,프렌즈캠핑장,충청북도 제천시 청풍면 도곡리 92번지,충청북도 제천시 청풍면 청풍명월로 869-9,27214,lake,caravan,pet,8,807,37.0043945,128.1328006,,
60,파라다이스캠프,강원도 영월군 무릉도원면 법흥리 137번지,강원도 영월군 무릉도원면 무릉법흥로 1128-10,26201,mountain,camping,family,4,420,37.3571384,128.2786679,,
61,병목안캠핑장,경기도 안양시 만안구 안양동 산 81-6번지,경기도 안양시 만안구 병목안로247번길 35,430010,river,glamping,couple,3,324,37.3822113,126.9101975,,
62,뉴욕카라반,강원도 속초시 대포동 478-7번지,강원도 속초시 동해대로 3847-7 (대포동),24900,sea,easycamping,kids,4,417,38.1782568,128.6016618,,
63,용소캠핑장,경기도 가평군 북면 도대리 335-3번지,경기도 가평군 북면 가화로 2411-32,12401,lake,caravan,pet,3,301,37.9546312,127.4732062,,
64,용담댐 오토캠핑장,전라북도 진안군 안천면 삼락리 1058-2번지,전라북도 진안군 안천면 안용로 539,55406,mountain,camping,family,9,913,35.9366772,127.5297622,,
65,우리두리 캠핑장,강원도 영월군 무릉도원면 법흥리 522,강원도 영월군 무릉도원면 백년계곡길 11,26201,river,glamping,couple,4,420,37.3660305,128.2720895,,
66,정화네불한증막 힐링캠프,전라북도 정읍시 고부면 신중리 305-18,전라북도 정읍시 고부면 덕신강길 148-4,56152,sea,easycamping,kids,9,912,35.6015147,126.7616626,,
67,유수암 캠핑장,제주특별자치도 제주시 애월읍 유수암리 2994,제주특별자치도 제주시 애월읍 하소로 684-25,63067,lake,caravan,pet,18,1801,33.422314,126.3939899,,
68,코코캠핑,충청북도 충주시 대소원면 탄용리 632-5,충청북도 충주시 대소원면 외동길 192,27473,mountain,camping,family,8,810,36.919742,127.8417206,,
69,히어리 캠핑장,강원도 영월군 김삿갓면 와석리 744번지,강원도 영월군 김삿갓면 김삿갓로 587-6,26246,lake,caravan,pet,4,420,37.1048241,128.6026791,,
70,삿갓펜션 캠핑장,강원도 영월군 김삿갓면 와석리 878번지,강원도 영월군 김삿갓면 김삿갓로 362,26246,mountain,camping,family,4,420,37.0909622,128.6035289,,
71,동해글램핑장,강원도 동해시 추암동 32,강원도 동해시 쉬눔길 80-1 (추암동),25790,sea,easycamping,kids,4,405,37.4720154,129.1535955,,
72,금관숲캠핑장,충청북도 청주시 상당구 미원면 금관리 336-4번지,충청북도 청주시 상당구 미원면 운암계원로 628,28201,lake,caravan,pet,8,809,36.6203129,127.7254761,,
73,칠성캠핑장,충청북도 괴산군 칠성면 사평리 10-1번지 야영장,충청북도 괴산군 칠성면 중부로 5611-21,28019,river,glamping,couple,8,801,36.7843851,127.8781532,,
74,북극곰,강원도 평창군 봉평면 흥정리 312-2번지,강원도 평창군 봉평면 흥정계곡길 313-3,25300,sea,easycamping,kids,4,413,37.6376283,128.3387439,,
75,자연과함께,강원도 영월군 무릉도원면 법흥리 61-7번지,강원도 영월군 무릉도원면 무릉법흥로 968-31,26201,lake,caravan,pet,4,420,37.3346139,128.2867708,,
76,하늘정원 캠핑장,인천광역시 강화군 길상면 동검리 17-14번지,인천광역시 강화군 길상면 동검길 21-1,23053,mountain,camping,family,2,201,37.5957327,126.5184629,,
77,맑은물소리캠핑장,경기도 가평군 설악면 천안리 727-6번지,경기도 가평군 설악면 가마소길 17-270,12469,sea,easycamping,kids,3,301,37.6348169,127.4728843,,
78,화원684글램핑,전라남도 해남군 화원면 매월리 684-7,전라남도 해남군 화원면 매봉길 528-8,59000,mountain,camping,family,11,1119,34.7595605,126.291787,,
79,캠프 B.T.S,강원도 삼척시 근덕면 덕산리 119-1 캠프장관리소,강원도 삼척시 근덕면 덕산해변길 82,25934,river,glamping,couple,4,406,37.3786803,129.2434984,,
80,이천농업테마공원 국민여가캠핑장,경기도 이천시 모가면 어농리 871-3,경기도 이천시 모가면 공원로 48,17406,sea,easycamping,kids,3,319,37.1839635,127.4316313,,
81,칠포그린로즈야영장,경상북도 포항시 북구 흥해읍 금장리 30-1,경상북도 포항시 북구 흥해읍 암각화길 31,37530,lake,caravan,pet,16,1621,36.1353877,129.3848033,,
82,아지트글램핑농원,경기도 포천시 화현면 화현리 533-3번지,경기도 포천시 화현면 화동로477번길 1,11123,mountain,camping,family,3,302,37.9087645,127.3072786,,
83,케이엘리조트,경기도 가평군 설악면 회곡리 305-4,경기도 가평군 설악면 유명로 2204,12459,river,glamping,couple,3,301,37.7014684,127.4548715,,
84,그림책동화마을 품 캠핑장,경기도 동두천시 탑동동 666,경기도 동두천시 삼육사로 1366 (탑동동),11360,mountain,camping,family,3,317,37.8895568,127.0988559,,
85,철이네캠핑장,경기도 가평군 설악면 가일리 223번지,경기도 가평군 설악면 유명산길 79-18,12473,river,glamping,couple,3,301,37.5941915,127.4906451,,
86,소나무 풍경 펜션 야영장,경상남도 창녕군 계성면 사리 325,경상남도 창녕군 계성면 계성화왕산로 161,50338,lake,caravan,pet,17,1712,35.4903167,128.5264615,,
87,강화바다관광농원,인천광역시 강화군 화도면 장화리 1122번지 강화바다관광농원,인천광역시 강화군 화도면 해안남로 2355,23061,mountain,camping,family,2,201,37.6135069,126.3823826,,
88,토일관광농원,경기도 포천시 군내면 직두리 160-4번지,경기도 포천시 군내면 청군로 2857,11155,river,glamping,couple,3,302,37.8673823,127.2491014,,
89,다놀자캠핑장,경상북도 상주시 화서면 하송리 372,경상북도 상주시 화서면 문장로 425-5,37138,sea,easycamping,kids,16,1609,36.47128,127.9638884,,
90,블루문캠핑장,경기도 가평군 상면 행현리 621-8,경기도 가평군 상면 수목원로386번길 43,12448,mountain,camping,family,3,301,37.7467337,127.3501316,,
91,하솜캠프,경기도 포천시 일동면 화대리 94-2번지,경기도 포천시 일동면 무리울길 40,11118,sea,easycamping,kids,3,302,37.9569505,127.3366085,,
92,에버그린 캠핑장,충청남도 논산시 벌곡면 덕곡리 172-4번지,충청남도 논산시 벌곡면 수락로237번길 26-96,33028,lake,caravan,pet,7,704,36.1720014,127.2938013,,
93,방길낚시캠핑장,전라북도 임실군 신덕면 삼길리 166-6번지,전라북도 임실군 신덕면 삼길1길 155-77,55903,mountain,camping,family,9,910,35.6821424,127.1321021,,
94,웰컴투캠프,강원도 영월군 무릉도원면 법흥리 535-3번지,강원도 영월군 무릉도원면 무릉법흥로 1128-20,26201,river,glamping,couple,4,420,37.3583197,128.2779261,,
95,별천지야영장,경기도 가평군 북면 화악리 741-7번지,경기도 가평군 북면 화악산로 816,12402,sea,easycamping,kids,3,301,37.9327613,127.5470684,,
96,선인장,전라남도 담양군 월산면 중월리 442번지,전라남도 담양군 월산면 담장로 548,57314,lake,caravan,pet,11,1107,35.349014,126.9222576,,
97,힐링캠프,울산광역시 울주군 상북면 덕현리 155-1,울산광역시 울주군 상북면 소야정길 10,44901,mountain,camping,family,14,1401,35.6164062,129.0536411,,
98,들소리 키즈 글램핑,전라남도 영암군 신북면 학동리 468번지 신북서초등학교,전라남도 영암군 신북면 들소리로 384-14,58400,river,glamping,couple,11,1114,34.9288277,126.6790086,,
99,불스글램핑 함평점,전라남도 함평군 함평읍 장년리 726,전라남도 함평군 함평읍 장년길 40,57136,sea,easycamping,kids,11,1118,35.0938256,126.4765173,,
100,서해캠핑장,인천광역시 중구 을왕동 810-308,인천광역시 중구 용유서로423번길 41 (을왕동),22383,lake,caravan,pet,2,203,37.4585324,126.3722299,,
101,노꼬담꼬,경상북도 경주시 산내면 감산리 668-4,경상북도 경주시 산내면 감존길 390-65,38185,mountain,camping,family,16,1602,35.8193702,129.0525286,,
102,호명산잣나무숲속캠핑장,경기도 가평군 청평면 상천리 산 392-1번지 상천지구농촌테마공원,경기도 가평군 청평면 상지로64번길 77,12449,river,glamping,couple,3,301,37.7703229,127.4560316,,
103,핀란드캠핑성,경기도 가평군 상면 봉수리 14,경기도 가평군 상면 물골길 102,12440,sea,easycamping,kids,3,301,37.8365633,127.3161182,,
104,잣향기푸른숲,경기도 가평군 상면 행현리 800,경기도 가평군 상면 축령로 183-53,12448,lake,caravan,pet,3,301,37.7741068,127.356023,,
105,솔향기 캠핑장,강원도 영월군 무릉도원면 법흥리 612-5,강원도 영월군 무릉도원면 무릉법흥로 787,26201,river,glamping,couple,4,420,37.3320319,128.2743941,,
106,펫힐링 달빛동물원 캠핑장,강원도 영월군 남면 연당리 647번지,강원도 영월군 남면 나뱅이길 61,26217,sea,easycamping,kids,4,420,37.1721783,128.4032055,,
107,문앤스타 캠핑장,경기도 양평군 용문면 중원리 399-2,경기도 양평군 용문면 중원산로 478,12512,lake,caravan,pet,3,304,37.542702,127.6173193,,
108,KEROAIN CAMP,강원도 영월군 무릉도원면 운학리 930-3번지,강원도 영월군 무릉도원면 학산길 26-9,26200,mountain,camping,family,4,420,37.3192583,128.1883956,,
109,소양호 뱃길나루터,강원도 양구군 양구읍 석현리 137-2,강원도 양구군 양구읍 소양호로 2522,24517,river,glamping,couple,4,407,38.0417987,127.9699164,,
110,십리포해수욕장 야영장,인천광역시 옹진군 영흥면 내리 724-195,인천광역시 옹진군 영흥면 영흥북로 388-1,23118,sea,easycamping,kids,2,202,37.2688539,126.4708583,,
111,소회산리멍우리협곡관광농원(캠핑장),경기도 포천시 영북면 소회산리 372번지,경기도 포천시 영북면 소회산길 399,11108,lake,caravan,pet,3,302,38.0923892,127.2337381,,
112,오지봉커뮤니센터 야영장,전라남도 곡성군 오산면 봉동리 945-152번지,전라남도 곡성군 오산면 오산로 663-17,57518,mountain,camping,family,11,1103,35.2407871,127.1158929,,
113,연지관광농원(연지곤지팜캠핑장),경기도 포천시 소흘읍 직동리 77-3,경기도 포천시 소흘읍 직동길 48,11186,river,glamping,couple,3,302,37.7668294,127.1690188,,
114,디데이펜션&캠핑,강원도 홍천군 서면 굴업리 271-11,강원도 홍천군 서면 안굴업길 39-13,25103,sea,easycamping,kids,4,414,37.6172699,127.675439,,
115,국립방태산자연휴양림,강원도 인제군 기린면 방동리 산 282-1번지 방태산자연휴양림,강원도 인제군 기린면 방태산길 241,24656,lake,caravan,pet,4,409,37.9294888,128.3890714,,
116,나드리야영장,강원도 인제군 북면 용대리 1036-4번지,강원도 인제군 북면 만해로 249,24606,mountain,camping,family,4,409,38.1889599,128.3620907,,
117,폭포가 있는 캠핑장,강원도 인제군 북면 용대리 366-2번지,강원도 인제군 북면 미시령로 1312,24605,river,glamping,couple,4,409,38.1889599,128.3620907,,
118,방태산솔마루오토캠핑장,강원도 인제군 기린면 방동리 260번지,강원도 인제군 기린면 방태산길 122-6,24656,sea,easycamping,kids,4,409,37.9126207,128.4151868,,
119,보광농촌체험휴양마을,강원도 강릉시 성산면 보광리 308번지,강원도 강릉시 성산면 보현길 5,25442,lake,caravan,pet,4,401,37.7373182,128.807125,,
120,여수자매로캠핑장,전라남도 여수시 화양면 이목리 39,전라남도 여수시 화양면 자매로 170,59653,river,glamping,couple,11,1112,34.6641323,127.5782888,,
121,강릉여행 GOOD캠핑,강원도 강릉시 사천면 방동리 112-5번지,강원도 강릉시 사천면 해안로 904-8,25440,sea,easycamping,kids,4,401,37.8317365,128.8763662,,
122,포레스트 캠핑장,경기도 포천시 화현면 명덕리 179-3번지,경기도 포천시 화현면 봉화로 269,11125,lake,caravan,pet,3,302,37.8734157,127.2783988,,
123,원's 캠핑장,인천광역시 강화군 삼산면 매음리 544-1,인천광역시 강화군 삼산면 삼산남로604번길 37,23007,mountain,camping,family,2,201,37.6646,126.3404091,,
124,집다리캠핑장,강원도 춘천시 사북면 지암리 127-4,강원도 춘천시 사북면 화악지암길 594,24200,river,glamping,couple,4,412,37.9789846,127.6226018,,
125,더스트림카라반 야영장,경상북도 영덕군 강구면 하저리 6-4번지,경상북도 영덕군 강구면 영덕대게로 579,36453,sea,easycamping,kids,16,1612,36.3935581,129.4146016,,
126,에스글램핑,충청남도 천안시 동남구 풍세면 풍서리 263,충청남도 천안시 동남구 풍세면 호정1길 28-17,31216,lake,caravan,pet,7,712,36.7170563,127.1293966,,
127,고사포야영장,전라북도 부안군 변산면 운산리 441-11,전라북도 부안군 변산면 변산해변로 765,56339,mountain,camping,family,9,906,35.6622738,126.5098696,,
128,타요캠핑장,강원도 삼척시 오분동 1-40,강원도 삼척시 삼척로 4246-29 (오분동),25930,river,glamping,couple,4,406,37.4313579,129.1901923,,
129,잔야캠핑,충청북도 괴산군 청천면 지촌리 84-4,충청북도 괴산군 청천면 도경로 638,28059,sea,easycamping,kids,8,801,36.7199773,127.8000568,,
130,영암 프리미엄 키즈글램핑,전라남도 영암군 시종면 신학리 709번지 시종신학초등학교,전라남도 영암군 시종면 신학1로 47,58428,lake,caravan,pet,11,1114,34.8240529,126.5780797,,
131,따봄,경기도 하남시 교산동 61,경기도 하남시 서하남로576번길 119 (교산동),13018,river,glamping,couple,3,325,37.518261,127.2071276,,
132,어썸캠핑장,인천광역시 강화군 화도면 내리 2530-6,인천광역시 강화군 화도면 마니산로 808-11,23060,sea,easycamping,kids,2,201,37.6346334,126.4085142,,
133,오솔길 오토 캠핑장,경상북도 경주시 산내면 내일리 756-2,경상북도 경주시 산내면 상목길 108-3,38185,lake,caravan,pet,16,1602,35.7420631,129.0751708,,
134,홍스랜드,제주특별자치도 제주시 애월읍 어음리 1412-1,제주특별자치도 제주시 애월읍 어음13길 25-45,63038,mountain,camping,family,18,1801,33.4024004,126.3478473,,
135,포유카라반파크,경상북도 포항시 남구 구룡포읍 구평리 504,경상북도 포항시 남구 구룡포읍 동해안로4176번길 12,37940,river,glamping,couple,16,1621,35.9410412,129.5311839,,
136,경산 갓바위캠핑장,경상북도 경산시 와촌면 대한리 553-3,경상북도 경산시 와촌면 갓바위로 596,38400,sea,easycamping,kids,16,1601,35.9857956,128.748239,,
137,나아정,경기도 가평군 상면 행현리 807-5,경기도 가평군 상면 축령로 183-102,12448,lake,caravan,pet,3,301,37.7726406,127.353022,,
138,유명산밸리 캠핑장,경기도 가평군 설악면 가일리 308-18,경기도 가평군 설악면 유명로 626,12473,mountain,camping,family,3,301,37.6021359,127.4935219,,
