번호,사업장명,소재지전체주소,도로명전체주소,도로명우편번호,자연환경,숙소환경,테마,지역코드,상세코드,위도,경도,COL1,COL2
962,푸른산수목원,경기도 포천시 영북면 산정리 511,경기도 포천시 영북면 산정호수로 359-30,11103,lake,caravan,pet,3,302,38.0691459,127.3108621,,
963,채움 관광농원,경기도 포천시 이동면 도평리 94,경기도 포천시 이동면 화동로 2496-22,11110,mountain,camping,family,3,302,38.0757063,127.4032977,,
964,메사 캠핑장,경기도 포천시 이동면 도평리 498-4,경기도 포천시 이동면 금강로 6145-45,11110,river,glamping,couple,3,302,38.0757063,127.4032977,,
965,큰마당캠핑장,경기도 포천시 이동면 도평리 471,경기도 포천시 이동면 화동로2457번길 76-1,11110,sea,easycamping,kids,3,302,38.0757063,127.4032977,,
966,엉클캠핑장,경기도 포천시 이동면 도평리 102-1,경기도 포천시 이동면 화동로 2498-1,11110,lake,caravan,pet,3,302,38.0757063,127.4032977,,
967,치유의 숲 야영장,경기도 포천시 신북면 금동리 28-2번지,경기도 포천시 신북면 탑신로 866-15,11137,mountain,camping,family,3,302,37.9280705,127.1410042,,
968,각흘계곡캠핑장,경기도 포천시 이동면 도평리 553-4,경기도 포천시 이동면 금강로 6439,11110,river,glamping,couple,3,302,38.0757063,127.4032977,,
969,홀스킹덤 팜스테이,경기도 포천시 내촌면 내리 91,경기도 포천시 내촌면 소리개길 108-13,11189,sea,easycamping,kids,3,302,37.7797121,127.2419733,,
970,뉴힐링캠프,경기도 포천시 이동면 도평리 490-4,경기도 포천시 이동면 금강로 6135-19,11110,lake,caravan,pet,3,302,38.0757063,127.4032977,,
971,병풍바위야영장,강원도 삼척시 원덕읍 산양리 1156-1,강원도 삼척시 원덕읍 산양서원1길 89 (산양1리마을회관),25959,mountain,camping,family,4,406,37.1410517,129.280254,,
972,(주)포레스트 카라반 파크,인천광역시 옹진군 영흥면 내리 1153-19,인천광역시 옹진군 영흥면 영흥로643번길 22,23117,river,glamping,couple,2,202,37.2688539,126.4708583,,
973,우산캠핑장,경상북도 상주시 외서면 우산리 223-3번지,경상북도 상주시 외서면 채릉산로 752,37134,lake,caravan,pet,16,1609,36.4725074,128.0659421,,
974,구마이오토캠핑장,경상북도 상주시 내서면 서만리 1013,경상북도 상주시 내서면 우서로 409,37148,mountain,camping,family,16,1609,36.4544867,128.0402876,,
975,성주봉자연휴양림 야영장,경상북도 상주시 은척면 남곡리 669,경상북도 상주시 은척면 성주봉로 91,37103,river,glamping,couple,16,1609,36.5303499,128.035831,,
976,상주보 캠프존 휴,경상북도 상주시 도남동 7-3,경상북도 상주시 용마로 469-10 (도남동),37242,lake,caravan,pet,16,1609,36.4562607,128.2524395,,
977,맑은개울캠핑장,경상북도 상주시 화서면 하송리 283-3번지,경상북도 상주시 화서면 하송3길 178-5,37138,river,glamping,couple,16,1609,36.4862903,127.9587485,,
978,계곡풍경야영장,경기도 가평군 북면 도대리 336-21번지,경기도 가평군 북면 가화로 2389-34 (계곡풍경펜션),12401,mountain,camping,family,3,301,37.9533445,127.4752101,,
979,소풍캠핑장,경기도 가평군 설악면 가일리 107-5번지,경기도 가평군 설악면 어비산길 184-151,12473,river,glamping,couple,3,301,37.5953266,127.5071436,,
980,(주)캠프통,경기도 가평군 청평면 고성리 761-5,경기도 가평군 청평면 호반로 976,12456,lake,caravan,pet,3,301,37.7097832,127.4843112,,
981,은하캠핑장,경기도 가평군 가평읍 읍내리 967-2,경기도 가평군 가평읍 잎너비길 18-91,12411,mountain,camping,family,3,301,37.8427395,127.5087672,,
982,을수민박야영,강원도 홍천군 내면 광원리 476번지,강원도 홍천군 내면 을수길 187,25170,sea,easycamping,kids,4,414,37.807025,128.4659907,,
983,안성운모석캠핑장,경기도 안성시 서운면 산평리 312-1번지,경기도 안성시 서운면 월구리길 3-85,17609,lake,caravan,pet,3,313,36.9204134,127.2718919,,
984,달곡캠프,울산광역시 북구 무룡동 607-5번지,울산광역시 북구 달곡1길 134-1 (무룡동),44234,mountain,camping,family,14,1403,35.6092345,129.4204889,,
985,벨하우스 글램핑,경기도 남양주시 수동면 지둔리 246,경기도 남양주시 수동면 지둔로445번안길 10-6,12028,river,glamping,couple,3,305,37.7265643,127.2967899,,
986,남양주 휴림,경기도 남양주시 수동면 지둔리 370,경기도 남양주시 수동면 지둔로 352-1,12028,mountain,camping,family,3,305,37.7142104,127.3001539,,
987,산여울 캠핑장,경기도 남양주시 수동면 내방리 335-2 외 5필지,경기도 남양주시 수동면 비룡로1742번길 3-16,12024,river,glamping,couple,3,305,37.7661885,127.2838696,,
988,더드림핑 야영장,경기도 남양주시 화도읍 금남리 123번지,경기도 남양주시 화도읍 북한강로 1630-18 (다판다연수원),12193,mountain,camping,family,3,305,37.6529829,127.3701474,,
989,마실 캠핑장,경기도 남양주시 오남읍 팔현리 250,경기도 남양주시 오남읍 팔현로216번길 24-1,12038,river,glamping,couple,3,305,37.6893545,127.2303118,,
990,깊이울관광농원(깊이울 캠핑장),경기도 포천시 신북면 심곡리 699-1,경기도 포천시 신북면 깊이울로 139-8,11136,lake,caravan,pet,3,302,37.9238559,127.1767138,,
991,아프리카예술박물관 캠핑장,경기도 포천시 소흘읍 무림리 41,경기도 포천시 소흘읍 광릉수목원로 967,11187,mountain,camping,family,3,302,37.775906,127.1388607,,
992,무지개펜션&캠핑,인천광역시 옹진군 영흥면 외리 23-2,인천광역시 옹진군 영흥면 영흥남로9번길 355-20,23121,river,glamping,couple,2,202,37.2479998,126.4544618,,
993,트리캠핑장,인천광역시 옹진군 영흥면 선재리 644-32,인천광역시 옹진군 영흥면 선재로306번길 27-55,23122,sea,easycamping,kids,2,202,37.2560921,126.5141982,,
994,농어바위캠핑장,인천광역시 옹진군 영흥면 내리 1326-30,인천광역시 옹진군 영흥면 영흥서로 420-19,23117,river,glamping,couple,2,202,37.2688539,126.4708583,,
995,명성가족캠핑촌,인천광역시 옹진군 영흥면 내리 1335-15,인천광역시 옹진군 영흥면 영흥로722번길 43-0 (명성리조텔),23117,sea,easycamping,kids,2,202,37.2688539,126.4708583,,
996,봉황산 자연휴양림 야영장,전라남도 여수시 돌산읍 신복리 산 391번지,전라남도 여수시 돌산읍 대복길 160,59777,lake,caravan,pet,11,1112,34.6169855,127.7553136,,
997,써니아일랜드,전라남도 여수시 남면 심장리 390번지,전라남도 여수시 남면 금오로 1137,59786,river,glamping,couple,11,1112,34.5049608,127.7813203,,
998,헤밍웨이 글램핑,전라남도 여수시 만흥동 464번지,전라남도 여수시 망양로 301 (만흥동),59622,sea,easycamping,kids,11,1112,34.7787833,127.7414658,,
999,봉황산 자연휴양림 제2야영장,전라남도 여수시 돌산읍 신복리 24번지,전라남도 여수시 돌산읍 대복길 160 (봉황산자연휴양림),59777,lake,caravan,pet,11,1112,34.6129386,127.7575663,,
1000,금오도 야영장,전라남도 여수시 남면 유송리 214번지,전라남도 여수시 남면 대유길 36-2,59785,mountain,camping,family,11,1112,34.5351616,127.7612922,,
1001,여수밤바다 관광농원,전라남도 여수시 돌산읍 평사리 1405-73번지,전라남도 여수시 돌산읍 진모1길 29-42,59771,river,glamping,couple,11,1112,34.6563978,127.7441661,,
1002,하얀바다 캠핑장,전라남도 여수시 돌산읍 금성리 847-6번지,전라남도 여수시 돌산읍 돌산로 649-12,59777,sea,easycamping,kids,11,1112,34.59283,127.76,,
1003,바람흔적글램핑카라반,경상남도 합천군 가회면 중촌리 217,경상남도 합천군 가회면 대기1길 15-9,50226,river,glamping,couple,17,1718,35.45931,128.0049,,
1004,오도산자연휴양림,경상남도 합천군 봉산면 압곡리 산 150번지,경상남도 합천군 봉산면 오도산휴양로 398,50210,sea,easycamping,kids,17,1718,35.65753,128.0547,,
1005,아빠랑놀자 키즈글램핑,경상남도 합천군 삼가면 동리 187번지,경상남도 합천군 삼가면 동리외초길 223,50219,lake,caravan,pet,17,1718,35.41602,128.1556,,
1006,대기농촌체험마을글램핑,경상남도 합천군 가회면 중촌리 420번지,경상남도 합천군 가회면 대기2길 17 (청소년수련원),50226,mountain,camping,family,17,1718,35.46252,128.002,,
1007,개금불 어뮤니티,경상남도 합천군 묘산면 봉곡리 140번지,경상남도 합천군 묘산면 봉곡1길 24-11,50209,river,glamping,couple,17,1718,35.37845,128.3887,,
1008,합천휴테마파크,경상남도 합천군 용주면 가호리 1180,경상남도 합천군 용주면 영상로 172,50215,mountain,camping,family,17,1718,35.54935,128.0572,,
1009,합천수피아캠핑,경상남도 합천군 봉산면 계산리 1840-1번지,경상남도 합천군 봉산면 합천호반로 954,50210,river,glamping,couple,17,1718,35.57237,128.0571,,
1010,글램핑스토리,경상남도 합천군 가야면 가천리 720번지,경상남도 합천군 가야면 구미가천로 345-1,50202,sea,easycamping,kids,17,1718,35.74927,128.0878,,
1011,살둔마을 생둔분교 캠핑장,강원도 홍천군 내면 율전리 221-17,강원도 홍천군 내면 살둔길 25,25169,mountain,camping,family,4,414,37.79714,128.3433,,
1012,물가솔솔캠핑장,강원도 홍천군 내면 광원리 471-4,강원도 홍천군 내면 을수길 153-6,25170,river,glamping,couple,4,414,37.80703,128.466,,
1013,여차울 캠핑장,강원도 홍천군 내면 방내리 147번지,강원도 홍천군 내면 여차동길 745-64,25169,sea,easycamping,kids,4,414,37.81058,128.2726,,
1014,화니캠핑앤글램핑,강원도 홍천군 동면 좌운리 120-1,강원도 홍천군 동면 안곡길 135-1,25155,lake,caravan,pet,4,414,37.64661,128.0339,,
1015,고길동 캠핑장,강원도 홍천군 북방면 북방리 946번지,강원도 홍천군 북방면 성동로 1625-16,25113,mountain,camping,family,4,414,37.82757,127.834,,
1016,국립삼봉자연휴양림 야영장,강원도 홍천군 내면 광원리 산 197-1,강원도 홍천군 내면 삼봉휴양길 276,25170,river,glamping,couple,4,414,37.80703,128.466,,
1017,용가리쌤 야영장,강원도 홍천군 화촌면 구성포리 65번지,강원도 홍천군 화촌면 설악로 2692,25156,sea,easycamping,kids,4,414,37.75381,127.9505,,
1018,캠프하다,강원도 홍천군 서면 개야리 42-2,강원도 홍천군 서면 개야마을길 68-27,25100,lake,caravan,pet,4,414,37.69285,127.6318,,
1019,탑캠핑장글램핑,강원도 홍천군 화촌면 군업리 345-2번지,강원도 홍천군 화촌면 군들길 20,25159,mountain,camping,family,4,414,37.74766,128.0345,,
1020,서석야영장,강원도 홍천군 서석면 생곡리 401-1,강원도 홍천군 서석면 고분대월길 67,25167,river,glamping,couple,4,414,37.6892,128.2662,,
1021,캐나디언 카누클럽 야영장,강원도 홍천군 서면 마곡리 23-1번지,강원도 홍천군 서면 마곡길 113-28,25100,sea,easycamping,kids,4,414,37.72217,127.5867,,
1022,팔봉산관광지 야영장,강원도 홍천군 서면 어유포리 272번지,강원도 홍천군 서면 한치골길 1124,25101,lake,caravan,pet,4,414,37.7034,127.6956,,
1023,개암벌 용소 관광농원 캠핑장,강원도 홍천군 두촌면 괘석리 617번지,강원도 홍천군 두촌면 군유동길 361-26,25160,mountain,camping,family,4,414,37.86046,128.0713,,
1024,가리산자연휴양림 야영장,강원도 홍천군 두촌면 천현리 134-1번지,강원도 홍천군 두촌면 가리산길 426,25164,river,glamping,couple,4,414,37.86216,128.0242,,
1025,스톤엑스 캠핑장,강원도 홍천군 남면 남노일리 234-1번지,강원도 홍천군 남면 남노일로 1164-22,25105,sea,easycamping,kids,4,414,37.68121,127.757,,
1026,산으로 캠핑장,강원도 홍천군 서면 마곡리 산 124-2번지,강원도 홍천군 서면 모곡로 365-139,25100,lake,caravan,pet,4,414,37.71436,127.5676,,
1027,북한산 캠핑장,서울특별시 은평구 진관동 330-14 북한산글램핑장,서울특별시 은평구 북한산로 232-1,3308,mountain,camping,family,1,104,37.65058,126.9378,,
1028,강촌하늘아래,강원도 춘천시 남산면 방곡리 351-3,강원도 춘천시 남산면 풀무골1길 71,24465,sea,easycamping,kids,4,412,37.80052,127.6414,,
1029,국립용화산자연휴양림,강원도 춘천시 사북면 고성리 산 102-13,강원도 춘천시 사북면 사여골길 294,24201,lake,caravan,pet,4,412,38.01135,127.7603,,
1030,춘천캠핑월드,강원도 춘천시 서면 서상리 896-1,강원도 춘천시 서면 툇골길 693,24460,mountain,camping,family,4,412,37.92977,127.6422,,
1031,화왕산자연휴양림야영장,경상남도 창녕군 고암면 감리 산 61-1,경상남도 창녕군 고암면 청간길 128-126,50315,sea,easycamping,kids,17,1712,35.54245,128.565,,
1032,창녕별숲글램핑,경상남도 창녕군 성산면 연당리 690-2,경상남도 창녕군 성산면 구연화길 62,50312,lake,caravan,pet,17,1712,35.62373,128.5212,,
1033,약수농원,경상남도 창녕군 고암면 감리 317번지,경상남도 창녕군 고암면 청간길 80,50315,mountain,camping,family,17,1712,35.55325,128.5706,,
1034,맑음터공원 캠핑장,경기도 오산시 오산동 750-1번지,경기도 오산시 오산천로 52 (오산동),18130,river,glamping,couple,3,327,37.13819,127.0645,,
1035,가창농원 야영장,대구광역시 달성군 가창면 삼산리 128,대구광역시 달성군 가창면 가창로10길 56,42940,lake,caravan,pet,12,1202,35.7274,128.6792,,
1036,별빛터카라반&글램핑펜션,경상남도 합천군 가회면 중촌리 196번지,경상남도 합천군 가회면 대기1길 15-7,50226,mountain,camping,family,17,1718,35.45945,128.0055,,
1037,가람관광농원,경상남도 합천군 봉산면 계산리 산 1620번지,경상남도 합천군 봉산면 인덕로 930,50210,river,glamping,couple,17,1718,35.58806,128.0621,,
1038,합천은하수글램핑&카라반,경상남도 합천군 용주면 고품리 284,경상남도 합천군 용주면 고품길 42,50212,lake,caravan,pet,17,1718,35.5373,128.1017,,
1039,(주)케이스톤매니지먼트(스톤힐),경기도 양평군 양평읍 양근리 552-4,경기도 양평군 양평읍 양근골안길 63,12546,mountain,camping,family,3,304,37.50039,127.486,,
1040,산음캠핑,경기도 양평군 단월면 산음리 685-1번지,경기도 양평군 단월면 고북길 76-23,12527,river,glamping,couple,3,304,37.59928,127.5963,,
1041,신화가족목공체험 캠핑소,경기도 양평군 강상면 신화리 387-2,경기도 양평군 강상면 강상로 328,12572,sea,easycamping,kids,3,304,37.46701,127.4686,,
1042,소노휴 양평,경기도 양평군 개군면 공세리 389-7,경기도 양평군 개군면 신내길7번길 55,12566,lake,caravan,pet,3,304,37.46902,127.5329,,
1043,황정민글램핑,경기도 가평군 조종면 상판리 141-2,경기도 가평군 조종면 명지산로 523,12431,mountain,camping,family,3,301,37.914,127.3843,,
1044,위크팜글램핑,경기도 가평군 상면 태봉리 249-8번지,경기도 가평군 상면 원흥길 37-6,12442,sea,easycamping,kids,3,301,37.818,127.3256,,
1045,우니메이카홍천본점,강원도 홍천군 서석면 검산리 357,강원도 홍천군 서석면 마리소리길 57,25167,lake,caravan,pet,4,414,37.72922,128.2392,,
1046,이스케이프 지점 휴토피아,강원도 홍천군 서면 어유포리 282-6,강원도 홍천군 서면 팔봉산로 976,25101,mountain,camping,family,4,414,37.69587,127.6896,,
1047,샘골솔밭야영장,강원도 홍천군 내면 광원리 667-12번지,강원도 홍천군 내면 구룡령로 6928,25170,river,glamping,couple,4,414,37.80703,128.466,,
1048,밤벌오토캠핑장,강원도 홍천군 서면 반곡리 3-65,강원도 홍천군 서면 팔봉산로 950,25101,sea,easycamping,kids,4,414,37.69317,127.6914,,
1049,리버카라반,강원도 홍천군 북방면 노일리 590번지,강원도 홍천군 북방면 노일로 144-8,25111,lake,caravan,pet,4,414,37.67463,127.741,,
1050,노일강 캠핑장,강원도 홍천군 북방면 노일리 923-1,강원도 홍천군 북방면 노일로 344-14,25111,mountain,camping,family,4,414,37.68913,127.7312,,
1051,살둔산장,강원도 홍천군 내면 율전리 212-10번지,강원도 홍천군 내면 살둔길 30-15,25169,river,glamping,couple,4,414,37.79714,128.3433,,
1052,클럽레스피아,강원도 홍천군 북방면 노일리 854-5,강원도 홍천군 북방면 구룡밭길 24-30,25111,sea,easycamping,kids,4,414,37.68466,127.728,,
1053,파크12,강원도 홍천군 서면 모곡리 491-46번지,강원도 홍천군 서면 밤벌길2번길 35,25100,lake,caravan,pet,4,414,37.69748,127.6021,,
1054,(주)쉐르빌리안티티,강원도 홍천군 서면 모곡리 547번지,강원도 홍천군 서면 밤벌길19번길 111,25100,mountain,camping,family,4,414,37.7018,127.5963,,
1055,하늘바라기 글램핑,강원도 홍천군 내촌면 화상대리 1206,강원도 홍천군 내촌면 아홉사리로 164-22,25163,river,glamping,couple,4,414,37.80395,128.0055,,
1056,홍천동산펜션오토캠핑장,강원도 홍천군 홍천읍 장전평리 868-3번지,강원도 홍천군 홍천읍 높은터로 332,25118,sea,easycamping,kids,4,414,37.64016,127.8507,,
1057,석산계곡 코코비발디글램핑 카라반 오토캠핑장,강원도 홍천군 서면 중방대리 419,강원도 홍천군 서면 고루개길 37-17,25104,lake,caravan,pet,4,414,37.66701,127.5992,,
1058,휴양빌리지 가온,강원도 홍천군 서면 중방대리 28,강원도 홍천군 서면 한서로 1304,25104,mountain,camping,family,4,414,37.64329,127.6201,,
1059,해솔캠핑장,강원도 홍천군 내촌면 답풍리 247-4,강원도 홍천군 내촌면 논골길 91,25163,river,glamping,couple,4,414,37.80771,128.0784,,
1060,칡소폭포 캠핑장,강원도 홍천군 내면 광원리 551-5,강원도 홍천군 내면 을수길 27,25170,sea,easycamping,kids,4,414,37.80703,128.466,,
1061,소백산국립공원 삼가야영장,경상북도 영주시 풍기읍 삼가리 302-1,경상북도 영주시 풍기읍 삼가로 509,36018,mountain,camping,family,16,1614,36.92647,128.5023,,
1062,주막거리캠프,경상북도 영주시 부석면 남대리 177-3번지,경상북도 영주시 부석면 영부로 847-10,36000,river,glamping,couple,16,1614,37.0393,128.6688,,
1063,산아래캠핑장,경상북도 영주시 부석면 남대리 46-2,경상북도 영주시 부석면 영부로890번길 132,36000,sea,easycamping,kids,16,1614,37.03545,128.6761,,
1064,비로야영장,경상북도 영주시 풍기읍 삼가리 251번지,경상북도 영주시 풍기읍 삼가로 447-11,36018,lake,caravan,pet,16,1614,36.92206,128.5047,,
1065,자연이랑캠프,강원도 영월군 무릉도원면 법흥리 156-1,강원도 영월군 무릉도원면 무릉법흥로 1174,26201,mountain,camping,family,4,420,37.36068,128.2749,,
1066,늘푸른 캠핑장,강원도 영월군 김삿갓면 내리 492-12번지 외 1필지,강원도 영월군 김삿갓면 내리계곡로 1116-4,26247,river,glamping,couple,4,420,37.07794,128.7082,,
1067,김삿갓계곡캠핑장,강원도 영월군 김삿갓면 와석리 913-3,강원도 영월군 김삿갓면 김삿갓로 216-30,26246,sea,easycamping,kids,4,420,37.07919,128.6025,,
1068,힐스톤 캠핑장,강원도 영월군 주천면 금마리 41-12,강원도 영월군 주천면 금용강변로 34-13,26206,lake,caravan,pet,4,420,37.24307,128.2789,,
1069,소나무와 계곡 캠핑장,강원도 영월군 무릉도원면 법흥리 311번지,강원도 영월군 무릉도원면 백년계곡길 88-3,26201,mountain,camping,family,4,420,37.37268,128.2723,,
1070,힐링캠프,강원도 춘천시 서면 서상리 897,강원도 춘천시 서면 툇골길 693-12,24460,river,glamping,couple,4,412,37.92956,127.6416,,
1071,강촌 캠핑플레이스,강원도 춘천시 남산면 백양리 산 1-2,강원도 춘천시 남산면 북한강변길 688,24464,sea,easycamping,kids,4,412,37.82547,127.5896,,
1072,강원도산림과학연구원 집다리골자연휴양림,강원도 춘천시 사북면 지암리 521-2 집다리골자연휴양림,강원도 춘천시 사북면 화악지암1길 130,24200,lake,caravan,pet,4,412,37.97761,127.5808,,
1073,다볼펜션,강원도 춘천시 남산면 창촌리 546,강원도 춘천시 남산면 둔일길 202,24465,mountain,camping,family,4,412,37.77495,127.6245,,
1074,어반슬로우시티,강원도 춘천시 남면 관천리 383,강원도 춘천시 남면 가옹개길 108,24468,river,glamping,couple,4,412,37.73256,127.5123,,
1075,강촌관광농원,강원도 춘천시 남산면 강촌리 498,강원도 춘천시 남산면 오양골길 125,24465,sea,easycamping,kids,4,412,37.81934,127.6012,,
1076,강촌포도팬션&캠핑장,강원도 춘천시 남산면 백양리 266,강원도 춘천시 남산면 서백2길 36,24464,lake,caravan,pet,4,412,37.80863,127.5731,,
1077,춘천숲자연휴양림,강원도 춘천시 동산면 군자리 산 403,강원도 춘천시 동산면 종자리로 224-104 (춘천숲자연휴양림),24409,mountain,camping,family,4,412,37.74455,127.7442,,
1078,더시크릿가든 캠프지라운드,강원도 춘천시 남산면 방하리 506-4,강원도 춘천시 남산면 방하로 297,24464,river,glamping,couple,4,412,37.76908,127.5529,,
1079,프라임캠핑장,강원도 춘천시 사북면 고성리 36-10,강원도 춘천시 사북면 사여골길 25,24201,sea,easycamping,kids,4,412,38.00774,127.7409,,
1080,국립자연휴양림관리소 북부지역팀(중미산휴양림),경기도 양평군 옥천면 신복리 산 201-2,경기도 양평군 옥천면 중미산로 1152,12505,lake,caravan,pet,3,304,37.58291,127.4525,,
1081,국립자연휴양림관리소 북부지역팀(산음자연휴양림),경기도 양평군 단월면 산음리 산 84,경기도 양평군 단월면 고북길 347,12527,mountain,camping,family,3,304,37.59018,127.6,,
1082,오커빌리지,경기도 양평군 용문면 연수리 530,경기도 양평군 용문면 장수길 22,12509,river,glamping,couple,3,304,37.5087,127.5641,,
1083,청운오토캠핑장,경기도 양평군 청운면 가현리 517,경기도 양평군 청운면 수풀길 37,12530,sea,easycamping,kids,3,304,37.54282,127.7023,,
1084,용문산관광지 야영장,경기도 양평군 용문면 신점리 525-2,경기도 양평군 용문면 용문산로 641,12510,lake,caravan,pet,3,304,37.54526,127.583,,
1085,용문산자연휴양림,경기도 양평군 양평읍 백안리 산 68-1,경기도 양평군 양평읍 약수사길 78-14,12547,mountain,camping,family,3,304,37.51638,127.5192,,
1086,참사람생태예술치유센터(산음숲자연학교),경기도 양평군 단월면 산음리 230-4,경기도 양평군 단월면 봉미산샘골길 1,12527,river,glamping,couple,3,304,37.60551,127.6012,,
1087,(주)캠핑어클락,경기도 가평군 하면 마일리 370-3,경기도 가평군 하면 연인산로474번길 27,12433,sea,easycamping,kids,3,301,37.84722,127.3775,,
1088,베스트캠핑장,경기도 가평군 가평읍 금대리 302-10,경기도 가평군 가평읍 북한강변로 517-8,12428,mountain,camping,family,3,301,37.77234,127.5353,,
1089,리즈밸리,경기도 가평군 설악면 가일리 40,경기도 가평군 설악면 어비산길 201-34,12473,river,glamping,couple,3,301,37.5917,127.5127,,
1090,더 플래츠 글램핑,경기도 가평군 상면 행현리 375-4,경기도 가평군 상면 수목원로 181-28,12448,lake,caravan,pet,3,301,37.76215,127.3644,,
1091,가평운악홀리데이카라반파크,경기도 가평군 조종면 신상리 206-10번지,경기도 가평군 조종면 운악청계로 424,12434,mountain,camping,family,3,301,37.85306,127.3563,,
1092,온더락캠핑장,경기도 가평군 상면 행현리 산 190번지,경기도 가평군 상면 수목원로 238-106,12448,river,glamping,couple,3,301,37.75982,127.3583,,
1093,지지밸리야영장,경기도 가평군 설악면 방일리 545-4번지,경기도 가평군 설악면 유명로 794-46,12472,sea,easycamping,kids,3,301,37.61628,127.4918,,
1094,캠플레이,경기도 가평군 상면 상동리 250-2번지,경기도 가평군 상면 비룡로 1610-15,12443,lake,caravan,pet,3,301,37.7807,127.2888,,
1095,휘게리 잣나무숲 캠핑장,강원도 홍천군 화촌면 장평리 411-19번지,강원도 홍천군 화촌면 구룡령로 1472-39,25159,mountain,camping,family,4,414,37.74164,128.1098,,
1096,늘편한캠핑장,강원도 홍천군 두촌면 괘석리 421-1,강원도 홍천군 두촌면 황병고개길 25-10,25160,river,glamping,couple,4,414,37.86402,128.1067,,
1097,보또피아힐링파크,강원도 홍천군 서면 두미리 785-20번지,강원도 홍천군 서면 개야로548번길 25-8,25101,sea,easycamping,kids,4,414,37.68084,127.6519,,
1098,용오름캠핑장,강원도 홍천군 서석면 검산리 326-1,강원도 홍천군 서석면 검산길 263,25167,lake,caravan,pet,4,414,37.72088,128.2361,,
1099,검산별빛야영장,강원도 홍천군 서석면 검산리 135-1,강원도 홍천군 서석면 마리소리길 120,25167,mountain,camping,family,4,414,37.73303,128.2437,,
1100,(주)가람레저산업 펠리즈29,강원도 홍천군 두촌면 철정리 33-2,강원도 홍천군 두촌면 부채들길 41,25164,river,glamping,couple,4,414,37.83495,128.0177,,
1101,홍천 무네미 별마루 관광농원,강원도 홍천군 내면 방내리 산 1289-5번지,강원도 홍천군 내면 수유동길 635,25169,sea,easycamping,kids,4,414,37.81058,128.2726,,
1102,J캠핑장,강원도 홍천군 내면 창촌리 786번지,강원도 홍천군 내면 소한동길 301,25171,lake,caravan,pet,4,414,37.79046,128.4297,,
