번호,사업장명,소재지전체주소,도로명전체주소,도로명우편번호,자연환경,숙소환경,테마,지역코드,상세코드,위도,경도,COL1,COL2
551,여울지숲속캠핑장,경기도 김포시 하성면 석탄리 242-10,경기도 김포시 하성면 오정동로 121-15,10012,sea,easycamping,kids,3,316,37.7268328,126.6449422,,
552,용인 둥지골 캠핑장,경기도 용인시 처인구 원삼면 죽능리 26-47,경기도 용인시 처인구 원삼면 후평로185번길 39,17170,lake,caravan,pet,3,307,37.1361654,127.3285735,,
553,비손관광농원 야영장,경상북도 포항시 북구 청하면 서정리 326-1,경상북도 포항시 북구 청하면 비학로 1889-157,37515,mountain,camping,family,16,1621,36.1978102,129.3177971,,
554,유곡면 농촌체험랜드,경상남도 의령군 유곡면 당동리 404,경상남도 의령군 유곡면 청정로 2278,52113,river,glamping,couple,17,1710,35.4325636,128.3167923,,
555,다둥이네캠핑장,경기도 가평군 북면 화악리 678-1,경기도 가평군 북면 화악산로 636,12402,sea,easycamping,kids,3,301,37.9348093,127.5630439,,
556,시골학교캠핑장,충청북도 제천시 봉양읍 옥전리 180,충청북도 제천시 봉양읍 제원로 653,27106,lake,caravan,pet,8,807,37.1734086,128.1052472,,
557,수산하늘풍경,강원도 인제군 남면 수산리 487,강원도 인제군 남면 무학길 34,24647,sea,easycamping,kids,4,409,37.9727318,128.0187588,,
558,곰취향 가득한 팔랑골 캠핑장,강원도 양구군 동면 팔랑리 1278-1,강원도 양구군 동면 바랑길 34-94,24506,lake,caravan,pet,4,407,38.2109131,128.0585536,,
559,러빙네이쳐,강원도 인제군 남면 부평리 1070-2 38휴게소,강원도 인제군 남면 설악로 1129,24646,mountain,camping,family,4,409,38.0016014,128.1157532,,
560,텐타우스 보문지점,경상북도 경주시 천군동 1579-3,경상북도 경주시 경감로 466-311 (천군동),38118,river,glamping,couple,16,1602,35.8143961,129.2705768,,
561,주전패밀리캠핑장,울산광역시 동구 주전동 714-4,울산광역시 동구 주전해안길 300 (주전동),44013,sea,easycamping,kids,14,1402,35.5517834,129.4549914,,
562,홀리데이캠핑파크,경기도 안산시 단원구 대부북동 1851-2,경기도 안산시 단원구 서위매봉길 14 (대부북동),15638,lake,caravan,pet,3,308,37.258289,126.5731267,,
563,산머루농원캠핑장,경기도 파주시 적성면 객현리 44-3,경기도 파주시 적성면 윗배우니길 441-42,10804,mountain,camping,family,3,309,37.9588659,126.9600921,,
564,일곱식구 캠핑장,전라북도 정읍시 칠보면 시산리 19-1,전라북도 정읍시 칠보면 행단1길 153,56128,river,glamping,couple,9,912,35.5867583,127.0135886,,
565,숲내음카라반캠핑장,전라북도 완주군 상관면 죽림리 628-1,전라북도 완주군 상관면 죽림편백길 143-5,55360,lake,caravan,pet,9,908,35.7415745,127.2075763,,
566,포게더 카라반 <지조개발>,경상남도 거제시 사등면 덕호리 269,경상남도 거제시 사등면 덕호해안길 147-1,53274,mountain,camping,family,17,1701,34.872421,128.4729981,,
567,안림딸기마을 캠핑장,경상북도 고령군 쌍림면 안림리 177-1 안림초등학교,경상북도 고령군 쌍림면 안림천길 19-6,40160,sea,easycamping,kids,16,1603,35.6924665,128.2604309,,
568,레저빌봉산,경상남도 합천군 봉산면 김봉리 418,경상남도 합천군 봉산면 서부로 4344-11,50211,lake,caravan,pet,17,1718,35.6270342,128.0445018,,
569,둥지캠핑장,강원도 화천군 사내면 용담리 111-9,강원도 화천군 사내면 돈내미길 183-39,24152,mountain,camping,family,4,415,38.071121,127.553325,,
570,네이스트 프라이빗 음성,충청북도 음성군 원남면 삼용리 471,충청북도 음성군 원남면 덕생로 167-15,27723,sea,easycamping,kids,8,806,36.8944031,127.5982144,,
571,블루문 오토캠핑,세종특별자치시 연서면 와촌리 806-2,세종특별자치시 연서면 기와말1길 20,30046,lake,caravan,pet,6,601,36.5586834,127.2504473,,
572,갈천힐링캠프,강원도 양양군 서면 갈천리 127-5,강원도 양양군 서면 구룡령로 1103-45,25040,mountain,camping,family,4,404,37.9069646,128.5053342,,
573,호수위의하루,충청북도 충주시 중앙탑면 탑평리 518-19,충청북도 충주시 중앙탑면 반천안길 63,27447,river,glamping,couple,8,810,37.0385992,127.856706,,
574,수입리 캠핑장,경기도 양평군 서종면 수입리 249-3,경기도 양평군 서종면 화서로246번길 22-6,12500,sea,easycamping,kids,3,304,37.640419,127.399049,,
575,매물도야영장,경상남도 통영시 한산면 매죽리 34-13,경상남도 통영시 한산면 당금길 50-9,53097,mountain,camping,family,17,1714,34.6384353,128.5699211,,
576,물의나라 캠핑장,경기도 가평군 조종면 상판리 146,경기도 가평군 조종면 명지산로 475,12431,sea,easycamping,kids,3,301,37.9103426,127.3812699,,
577,안면도스쿨버스캠핑장,충청남도 태안군 안면읍 중장리 1586-1,충청남도 태안군 안면읍 안면대로 3356-1,32168,lake,caravan,pet,7,702,36.4866369,126.3832622,,
578,캠핑소사이어티,경상남도 진주시 내동면 유수리 564-6,경상남도 진주시 내동면 내축로 523,52848,mountain,camping,family,17,1711,35.1290423,128.0225815,,
579,금계관광농원,충청남도 공주시 유구읍 문금리 599,충청남도 공주시 유구읍 문금길 86,32500,river,glamping,couple,7,701,36.6375008,126.9838131,,
580,산내 명수관광농원,경상북도 경주시 산내면 감산리 1278,경상북도 경주시 산내면 장사길 46-17,38185,mountain,camping,family,16,1602,35.7903475,129.0501745,,
581,수승대체험휴양마을,경상남도 거창군 위천면 강천리 99-1,경상남도 거창군 위천면 원학길 410,50103,river,glamping,couple,17,1702,35.7527858,127.8309752,,
582,평창 자연속쉼표캠핑장,강원도 평창군 봉평면 흥정리 95-3,강원도 평창군 봉평면 흥정계곡4길 171-10,25300,sea,easycamping,kids,4,413,37.6568629,128.3085988,,
583,글램핑로망,대구광역시 달성군 옥포읍 김흥리 973,대구광역시 달성군 옥포읍 옥포로111길 85-6,42977,lake,caravan,pet,12,1202,35.7413347,128.4948808,,
584,강가민박캠핑장,경상남도 거창군 북상면 농산리 601-1,경상남도 거창군 북상면 덕유월성로 2123-15,50101,river,glamping,couple,17,1702,35.7799871,127.8001065,,
585,김삿갓삿갓 쉼터,강원도 영월군 김삿갓면 각동리 126-20,강원도 영월군 김삿갓면 강변로 1390,26245,sea,easycamping,kids,4,420,37.1135661,128.5296202,,
586,아띠캠핑장,경기도 연천군 군남면 삼거리 597,경기도 연천군 군남면 군남로 373,11006,lake,caravan,pet,3,310,38.0811895,127.0169545,,
587,우이동 가족캠핑장,서울특별시 강북구 우이동 317 우이동 가족캠핑장 방문자센터,서울특별시 강북구 삼양로181길 28,1000,mountain,camping,family,1,103,37.6653563,127.011749,,
588,달숲스테이,충청북도 제천시 금성면 월림리 16-2,충청북도 제천시 금성면 산곡3길 151,27208,river,glamping,couple,8,807,37.088359,128.1888709,,
589,문두리 캠핑장,경상북도 경주시 산내면 대현리 2747-221,경상북도 경주시 산내면 문복로 333-42,38187,lake,caravan,pet,16,1602,35.6636568,129.0536464,,
590,천안밤나무골가족캠핑농원,충청남도 천안시 서북구 성거읍 송남리 산 40,충청남도 천안시 서북구 성거읍 보명사길 74-13,31046,sea,easycamping,kids,7,712,36.8598818,127.1999584,,
591,두바퀴로 가는 자동차 관광농원,경상북도 경주시 산내면 신원리 647,경상북도 경주시 산내면 외칠일부길 278-182,38186,lake,caravan,pet,16,1602,35.7540323,129.0009176,,
592,오래캠핑장,경기도 가평군 북면 소법리 137-2번지,경기도 가평군 북면 화악산로 233,12404,mountain,camping,family,3,301,37.9022363,127.5595136,,
593,HJ글램핑,경기도 포천시 이동면 도평리 512-4,경기도 포천시 이동면 금강로 6169,11110,river,glamping,couple,3,302,38.0757063,127.4032977,,
594,경주 더숲 관광농원,경상북도 경주시 내남면 명계리 485-2,경상북도 경주시 내남면 내외로 731-107,38198,sea,easycamping,kids,16,1602,35.7089924,129.2566036,,
595,옥계마을회영농조합법인,경상남도 거제시 하청면 연구리 414-9,경상남도 거제시 하청면 칠천로 265-17,53203,lake,caravan,pet,17,1701,34.9784998,128.6303448,,
596,스톤힐,경상남도 거제시 수월동 122-12,경상남도 거제시 수양1길 92-5 (수월동),53240,mountain,camping,family,17,1701,34.8917931,128.6546495,,
597,풍혈산 캠핑장,경기도 포천시 일동면 수입리 903번지,경기도 포천시 일동면 성장로 397,11115,river,glamping,couple,3,302,38.0142428,127.2953896,,
598,썬오브캠핑장,경기도 포천시 이동면 도평리 538-6,경기도 포천시 이동면 금강로6263번길 14,11110,lake,caravan,pet,3,302,38.0757063,127.4032977,,
599,명성산글램핑,경기도 포천시 영북면 산정리 390-4번지,경기도 포천시 영북면 산정호수로 1017,11103,mountain,camping,family,3,302,38.0900273,127.3197428,,
600,포천 자연마을 서울캠핑장,경기도 포천시 관인면 사정리 136-1번지,경기도 포천시 관인면 북원로 371-115,11101,river,glamping,couple,3,302,38.1235798,127.2534535,,
601,맑은물소리 캠핑장,경기도 포천시 관인면 삼율리 6,경기도 포천시 관인면 담터길 123,11100,sea,easycamping,kids,3,302,38.1483128,127.206664,,
602,나무다 캠핑장,경기도 포천시 신북면 심곡리 763 외 1필지(769-1),경기도 포천시 신북면 깊이울로 167,11136,lake,caravan,pet,3,302,37.9227054,127.1723578,,
603,대청마루 물소리,경기도 포천시 관인면 삼율리 10번지 외 1필지(493번지),경기도 포천시 관인면 담터길 239,11100,river,glamping,couple,3,302,38.1556884,127.1982158,,
604,깊이울 달빛 캠핑장,경기도 포천시 신북면 심곡리 734-3,경기도 포천시 신북면 깊이울로 204,11136,sea,easycamping,kids,3,302,37.9213966,127.1690786,,
605,사랑나무 캠핑장,강원도 영월군 김삿갓면 내리 87,강원도 영월군 김삿갓면 내리계곡로 131-12,26247,mountain,camping,family,4,420,37.0779437,128.7082094,,
606,영월천문대 캠핑장,강원도 영월군 북면 연덕리 931번지,강원도 영월군 북면 사만길 173,26208,river,glamping,couple,4,420,37.2635863,128.4099912,,
607,영월키즈캠핑장,강원도 영월군 무릉도원면 법흥리 181,강원도 영월군 무릉도원면 무릉법흥로 1208-7,26201,sea,easycamping,kids,4,420,37.3641271,128.2733673,,
608,아날로거 무릉도원점,강원도 영월군 무릉도원면 무릉리 608-2,강원도 영월군 무릉도원면 아래골길 10,26201,lake,caravan,pet,4,420,37.2924942,128.2750535,,
609,호식이 캠핑장,강원도 영월군 주천면 판운리 714-6번지,강원도 영월군 주천면 중선로 215,26202,mountain,camping,family,4,420,37.3115479,128.318627,,
610,남강 캠프,강원도 영월군 무릉도원면 법흥리 89-9번지,강원도 영월군 무릉도원면 무릉법흥로 1050-16,26201,river,glamping,couple,4,420,37.350179,128.2798996,,
611,두산분교 캠핑장,강원도 영월군 무릉도원면 두산리 453-3번지,강원도 영월군 무릉도원면 두산길 237-4,26200,sea,easycamping,kids,4,420,37.3080162,128.1704926,,
612,달과별 캠핑장,강원도 영월군 상동읍 덕구리 18,강원도 영월군 상동읍 덕구로 432-25,26248,lake,caravan,pet,4,420,37.095083,128.8108591,,
613,새막골 캠프,강원도 영월군 무릉도원면 두산리 304-1번지,강원도 영월군 무릉도원면 새막골길 72-115,26200,mountain,camping,family,4,420,37.3237241,128.1786364,,
614,느티나무 캠핑장,강원도 영월군 김삿갓면 내리 474,강원도 영월군 김삿갓면 내리계곡로 1061,26247,river,glamping,couple,4,420,37.0779437,128.7082094,,
615,뜨란솔 캠핑장,강원도 영월군 무릉도원면 법흥리 625-1번지,강원도 영월군 무릉도원면 무릉법흥로 782-26,26201,sea,easycamping,kids,4,420,37.3317951,128.2766288,,
616,보보스캇 캠핑장,강원도 영월군 주천면 판운리 463,강원도 영월군 주천면 미다리길 50-24,26202,lake,caravan,pet,4,420,37.2913138,128.3264344,,
617,정든 캠핑장,강원도 영월군 무릉도원면 법흥리 712번지,강원도 영월군 무릉도원면 무릉법흥로 644-9,26201,mountain,camping,family,4,420,37.3249052,128.2636353,,
618,꿈엔들 캠프장,강원도 영월군 무릉도원면 법흥리 51,강원도 영월군 무릉도원면 무릉법흥로 968-12,26201,river,glamping,couple,4,420,37.3428027,128.2809636,,
619,서종 힐링캠핑장,경기도 양평군 서종면 노문리 465,경기도 양평군 서종면 화서로 532-6,12500,sea,easycamping,kids,3,304,37.6478035,127.4262728,,
620,양평 드림캠핑장,경기도 양평군 용문면 금곡리 231-12 외 13필지,경기도 양평군 용문면 갈지길41번길 52,12513,lake,caravan,pet,3,304,37.5004233,127.623111,,
621,스마일 캠핑장,경기도 양평군 단월면 석산리 148-1,경기도 양평군 단월면 석산로 1539-2,12525,mountain,camping,family,3,304,37.6463879,127.6163846,,
622,플라워 카라반 펜션,경기도 양평군 단월면 석산리 148-7 148-5,경기도 양평군 단월면 석산로 1543-9,12525,river,glamping,couple,3,304,37.6463879,127.6163846,,
623,양평맑은숲캠핑장,경기도 양평군 청운면 다대리 산 45-2,경기도 양평군 청운면 오목골길 33,12531,sea,easycamping,kids,3,304,37.5636853,127.7325533,,
624,솔뜰,경기도 양평군 옥천면 신복리 424-1,경기도 양평군 옥천면 사기점길 45,12505,mountain,camping,family,3,304,37.5410604,127.4675792,,
625,배너미오토캠핑장,경상북도 청도군 운문면 신원리 32번지,경상북도 청도군 운문면 운문로 1051,38368,sea,easycamping,kids,16,1619,35.6658315,129.0026839,,
626,I go,경상북도 청도군 매전면 호화리 752-78,경상북도 청도군 매전면 온장길 123-46,38356,lake,caravan,pet,16,1619,35.643378,128.850326,,
627,국립운문산자연휴양림 야영장,경상북도 청도군 운문면 신원리 산 29-6번지,경상북도 청도군 운문면 운문로 763,38368,mountain,camping,family,16,1619,35.6534002,129.0187167,,
628,포천계곡캠핑장,경기도 포천시 이동면 도평리 542-1,경기도 포천시 이동면 금강로 6304,11110,sea,easycamping,kids,3,302,38.0757063,127.4032977,,
629,호반 캠핑장,강원도 춘천시 신동 970-1,강원도 춘천시 영서로 3189 (신동),24207,lake,caravan,pet,4,412,37.9339721,127.7178084,,
630,YELLOW HILL,강원도 춘천시 동산면 군자리 1020,강원도 춘천시 동산면 종자리로 224-24,24409,mountain,camping,family,4,412,37.7499089,127.7335481,,
631,강촌버즈글램핑(강촌팜핑),강원도 춘천시 서면 안보리 403,강원도 춘천시 서면 율장길 122-28,24463,river,glamping,couple,4,412,37.8497311,127.5807137,,
632,춘천하늘캠핑장,강원도 춘천시 서면 방동리 981,강원도 춘천시 서면 방동1길 315,24460,sea,easycamping,kids,4,412,37.9128188,127.6563897,,
633,국립회문산자연휴양림,전라북도 순창군 구림면 안정리 40-2,전라북도 순창군 구림면 안심길 214,56011,lake,caravan,pet,9,907,35.4980511,127.1218125,,
634,녹두장군 전봉준관,전라북도 순창군 쌍치면 금성리 276,전라북도 순창군 쌍치면 피노길 65-29,56007,mountain,camping,family,9,907,35.5242264,127.0127093,,
635,웅이네 캠핑장,전라북도 순창군 복흥면 대방리 285-10번지,전라북도 순창군 복흥면 용지길 7-50,56005,river,glamping,couple,9,907,35.4083123,126.9464892,,
636,회문산 캠핑장,전라북도 순창군 구림면 금천리 378,전라북도 순창군 구림면 구림로 791,56011,sea,easycamping,kids,9,907,35.4762781,127.1023417,,
637,섬진강 마실캠핑장,전라북도 순창군 적성면 석산리 1-1,전라북도 순창군 적성면 강경길 76-165,56022,lake,caravan,pet,9,907,35.4599326,127.2014649,,
638,뜨란채,전라북도 순창군 팔덕면 청계리 1028번지,전라북도 순창군 팔덕면 강천로 664-26 (뜨란채),56020,mountain,camping,family,9,907,35.4160577,127.077498,,
639,청산별곡,전라북도 순창군 동계면 수장리 570-17번지,전라북도 순창군 동계면 수장2길 38-4,56028,river,glamping,couple,9,907,35.4356483,127.2670432,,
640,거북바위야영장,경기도 양평군 서종면 서후리 234-1,경기도 양평군 서종면 거북바위1길 185,12504,lake,caravan,pet,3,304,37.5673434,127.429176,,
641,산대분교공공캠핑장,경기도 양평군 단월면 석산리 470번지,경기도 양평군 단월면 섬이길 274-12,12525,mountain,camping,family,3,304,37.6295921,127.5836461,,
642,분지울작은캠프장,경기도 양평군 단월면 명성리 98-1,경기도 양평군 단월면 분지울1길 81,12526,river,glamping,couple,3,304,37.6086248,127.6720401,,
643,the 休 글램핑,경기도 양평군 옥천면 옥천리 514-1,경기도 양평군 옥천면 옥천체육공원길 4,12508,sea,easycamping,kids,3,304,37.5229432,127.4607662,,
644,국립청옥산자연휴양림,경상북도 봉화군 석포면 13-64번지,경상북도 봉화군 석포면 청옥로 1552-163,36271,lake,caravan,pet,16,1608,37.0486457,129.0651698,,
645,봉화열목어마을야영장,경상북도 봉화군 석포면 대현리 90-5번지,경상북도 봉화군 석포면 청옥로 1893,36271,mountain,camping,family,16,1608,37.0657764,128.9870352,,
646,고향펜션캠핑,경상북도 봉화군 소천면 고선리 558번지,경상북도 봉화군 소천면 구마동길 1032,36264,river,glamping,couple,16,1608,36.9996379,128.9647656,,
647,청옥야영장,경상북도 봉화군 소천면 현동리 744-6번지,경상북도 봉화군 소천면 청옥로 167,36266,sea,easycamping,kids,16,1608,36.9474233,128.9980857,,
648,호명산캠프,경기도 가평군 청평면 하천리 410번지,경기도 가평군 청평면 솥틀로 91,12450,river,glamping,couple,3,301,37.7624243,127.4287765,,
649,국립유명산자연휴양림,경기도 가평군 설악면 가일리 산 35번지,경기도 가평군 설악면 유명산길 79-53,12473,sea,easycamping,kids,3,301,37.5928839,127.4920842,,
650,캡틴 카라반 글램핑,경기도 가평군 상면 임초리 477-1,경기도 가평군 상면 청군로 776-22,12447,lake,caravan,pet,3,301,37.780876,127.3713366,,
651,수류산골야영장,전라북도 김제시 금산면 금성리 267번지,전라북도 김제시 금산면 수류로 557-75,54344,mountain,camping,family,9,903,35.6894521,127.039183,,
652,봉식이놀이터,경상북도 청도군 풍각면 수월리,경상북도 청도군 풍각면 봉수길 749-8,38306,river,glamping,couple,16,1619,35.6701697,128.5582662,,
653,지오 캠핑장,경상북도 청도군 매전면 호화리 734-28,경상북도 청도군 매전면 동화길 8-31,38356,sea,easycamping,kids,16,1619,35.6587533,128.8563832,,
654,화이트 야영장,경상북도 청도군 매전면 호화리 752-36번지,경상북도 청도군 매전면 온장길 123-56,38356,lake,caravan,pet,16,1619,35.6439534,128.8502835,,
655,청도 그린나래캠핑장,경상북도 청도군 매전면 송원리 900,경상북도 청도군 매전면 송원길 122-3,38358,sea,easycamping,kids,16,1619,35.6161736,128.8038868,,
656,신난다 글램핑,경상북도 청도군 각북면 금천리 427,경상북도 청도군 각북면 송내길 57-13,38301,lake,caravan,pet,16,1619,35.7200378,128.5732849,,
657,별찌야영장,경상북도 청도군 운문면 신원리 92번지,경상북도 청도군 운문면 신원4길 2,38368,mountain,camping,family,16,1619,35.6676925,129.0011939,,
658,청도 프로방스카라반 캠핑카펜션,경상북도 청도군 화양읍 삼신리 823번지,경상북도 청도군 화양읍 이슬미로 297-41,38324,sea,easycamping,kids,16,1619,35.687635,128.7153404,,
659,연지곤지야영장,경상북도 청도군 운문면 신원리 301-13번지,경상북도 청도군 운문면 운문로 1158-16,38368,sea,easycamping,kids,16,1619,35.6733036,128.9992989,,
660,양주송천캠핑장,경기도 양주시 백석읍 기산리 382-5,경기도 양주시 백석읍 기산로440번길 74-20,11518,sea,easycamping,kids,3,306,37.7737334,126.9381918,,
661,일영모자농원캠핑장,경기도 양주시 장흥면 삼상리 10-17,경기도 양주시 장흥면 유원지로 316-1,11524,lake,caravan,pet,3,306,37.7083474,126.953516,,
662,해피캠핑장,경기도 양주시 백석읍 기산리 302-6,경기도 양주시 백석읍 기산로471번길 110,11518,mountain,camping,family,3,306,37.7802459,126.9438087,,
663,들꽃피는언덕 캠핑장,경기도 양주시 백석읍 기산리 181-1,경기도 양주시 백석읍 권율로 870,11518,river,glamping,couple,3,306,37.7761011,126.9600967,,
664,황방농원 캠핑장,경기도 양주시 남면 황방리 140,경기도 양주시 남면 양연로173번길 49,11402,sea,easycamping,kids,3,306,37.9214223,126.9968574,,
665,양주 탑 관광농원 글램핑장,경기도 양주시 삼숭동 481-1,경기도 양주시 어하고개로 48-1 (삼숭동),11477,lake,caravan,pet,3,306,37.8107725,127.1022947,,
666,별을 다는 아이,경기도 양주시 장흥면 석현리 336-3,경기도 양주시 장흥면 권율로309번길 132,11519,mountain,camping,family,3,306,37.7447811,126.953675,,
667,장흥숲길캠핑장,경기도 양주시 장흥면 일영리 2-20,경기도 양주시 장흥면 권율로 156-116,11520,river,glamping,couple,3,306,37.707221,126.9380811,,
668,스톤밸리캠핑장,경기도 양주시 봉양동 154-1,경기도 양주시 칠봉산로228번길 126-5 (봉양동),11448,sea,easycamping,kids,3,306,37.8589581,127.0813743,,
669,청화산캠프 관광농원,경상북도 군위군 소보면 보현리 10번지,경상북도 군위군 소보면 소보안계로 646-36,39000,lake,caravan,pet,16,1605,36.3068273,128.4621849,,
670,80 SS 오토캠핑장,경상북도 군위군 부계면 남산리 1138-4번지,경상북도 군위군 부계면 한티로 1525-6,39066,mountain,camping,family,16,1605,36.0300417,128.6304762,,
671,동산계곡야영장,경상북도 군위군 부계면 동산리 417번지,경상북도 군위군 부계면 원효길 129-9,39065,river,glamping,couple,16,1605,36.0464722,128.6656598,,
672,넓은마당 캠핑장,경기도 포천시 이동면 도평리 469-8번지,경기도 포천시 이동면 화동로 2530,11110,lake,caravan,pet,3,302,38.0757063,127.4032977,,
673,캠핑플래닛,경기도 포천시 화현면 명덕리 10-8 외 1필지(10-6번지),경기도 포천시 화현면 봉화로 400-150,11125,river,glamping,couple,3,302,37.8879696,127.2828156,,
674,자일랜드,경기도 포천시 영북면 자일리 8,경기도 포천시 영북면 호국로4350번길 154-188,11102,sea,easycamping,kids,3,302,38.1054955,127.3091286,,
675, 자켓(Wet Jacket),경기도 포천시 이동면 장암리 50 외 1필지(50-1번지),경기도 포천시 이동면 늠바위길 201-3,11111,lake,caravan,pet,3,302,38.0291681,127.387489,,
676,포천 베어스 글램핑 파크,경기도 포천시 내촌면 신팔리 388-2,경기도 포천시 내촌면 금강로 3009,11188,mountain,camping,family,3,302,37.8323651,127.2657822,,
677,광릉솔개캠핑장,경기도 포천시 소흘읍 이곡리 524-3,경기도 포천시 소흘읍 광릉수목원로779번길 120,11187,river,glamping,couple,3,302,37.764206,127.1453783,,
678,삼정 관광농원,경기도 포천시 신북면 삼정리 291번지 외 1필지(291-5번지),경기도 포천시 신북면 청신로947번길 207,11137,sea,easycamping,kids,3,302,37.9787214,127.1353432,,
679,아이에프에이 캠프 운악,경기도 포천시 화현면 화현리 1090-2,경기도 포천시 화현면 금강로 3806-80,11123,lake,caravan,pet,3,302,37.8939272,127.3056871,,
680,추동캠프,경기도 포천시 창수면 추동리 812,경기도 포천시 창수면 포천로2811번길 194,11134,mountain,camping,family,3,302,37.9917693,127.15567,,
681,꾸러기캠핑장,경상남도 진주시 금곡면 동례리 886번지,경상남도 진주시 금곡면 검암길 31 (금곡초등학교),52842,river,glamping,couple,17,1711,35.1154006,128.1819876,,
682,도토리캠프,경상남도 진주시 명석면 계원리 174-1번지,경상남도 진주시 명석면 광제산로 737,52641,sea,easycamping,kids,17,1711,35.2764881,128.0388658,,
683,제이원빌리지,경상남도 진주시 내동면 유수리 691-4번지,경상남도 진주시 내동면 내축로563번길 27-3,52848,lake,caravan,pet,17,1711,35.1315473,128.0174831,,
684,국립운장산자연휴양림 야영장,전라북도 진안군 정천면 갈용리 산 183번지,전라북도 진안군 정천면 휴양림길 77,55410,mountain,camping,family,9,913,35.8947554,127.4257541,,
685,진안 국제 캠핑장,전라북도 진안군 용담면 와룡리 74-1번지 진안국제캠핑장,전라북도 진안군 용담면 와룡길 165-6,55404,sea,easycamping,kids,9,913,35.9655034,127.4612836,,
686,숲 펜션&캠핑장,전라북도 진안군 부귀면 두남리 24,전라북도 진안군 부귀면 석원로 22,55415,lake,caravan,pet,9,913,35.8548236,127.428417,,
687,도원패밀리캠핑장,강원도 영월군 무릉도원면 도원리 367번지,강원도 영월군 무릉도원면 엄둔길 390,26201,mountain,camping,family,4,420,37.3277259,128.2321232,,
688,예다움 캠핑장,강원도 영월군 김삿갓면 내리 551번지,강원도 영월군 김삿갓면 내리계곡로 1162-1,26247,river,glamping,couple,4,420,37.0779437,128.7082094,,
689,물마루 캠핑장,강원도 영월군 무릉도원면 두산리 222-1,강원도 영월군 무릉도원면 두산길 106,26200,sea,easycamping,kids,4,420,37.3125646,128.1798713,,
